{"iteration": 0, "score": 0.2857, "best": 0.2857, "eval_type": "BASELINE", "status": "BASELINE", "timestamp": "2026-04-28 07:03:01"}
{"iteration": 1, "score": 0.5714, "best": 0.5714, "eval_type": "SAMPLE", "status": "KEPT", "categories": {"product": 0.6667, "shop": 1.0, "voucher": 0.0}, "changes": "Expanded the single-product candidate pool from 2 pages (~20 results) to 3 pages (~30 results) and raised `TOP_RELEVANCE_CANDIDATES` from 20 to 30, so all fetched candidates receive full attribute-det", "timestamp": "2026-04-28 07:08:11"}
{"iteration": 2, "score": 0.4286, "best": 0.5714, "eval_type": "SAMPLE", "status": "REVERTED", "categories": {"product": 0.6667, "shop": 0.5, "voucher": 0.0}, "changes": "Changed `use_keyword_query_for_multi=True` to `use_keyword_query_for_multi=(len(products) > 1)` in `_handle_voucher_search`, so single-product voucher tasks score candidates against the full query (re", "timestamp": "2026-04-28 07:16:15"}
{"iteration": 3, "score": 0.4286, "best": 0.5714, "eval_type": "SAMPLE", "status": "REVERTED", "categories": {"product": 0.6667, "shop": 0.5, "voucher": 0.0}, "changes": "Changed `use_keyword_query_for_multi=True` to `use_keyword_query_for_multi=False` in `_handle_voucher_search` so voucher product candidates are ranked against the full query (stopwords already filter ", "timestamp": "2026-04-28 07:22:01"}
{"iteration": 4, "score": 0.4286, "best": 0.5714, "eval_type": "SAMPLE", "status": "REVERTED", "categories": {"product": 0.6667, "shop": 0.5, "voucher": 0.0}, "changes": "Increased `extra_pages` from 1 to 2 in `_handle_voucher_search`, giving voucher tasks 3 pages of candidates (matching the product handler) to improve the chance of finding a correctly-priced matching ", "timestamp": "2026-04-28 07:28:54"}
{"iteration": 5, "score": 0.2667, "best": 0.5714, "eval_type": "FULL", "status": "REVERTED", "categories": {"product": 0.4, "shop": 0.4, "voucher": 0.0}, "changes": "Removed the per-product equal-division of the voucher price ceiling — now each product searches within the full gross budget range instead of `budget/n_products`, preventing valid higher-priced item", "timestamp": "2026-04-28 07:56:11"}
{"iteration": 6, "score": 0.4286, "best": 0.5714, "eval_type": "SAMPLE", "status": "REVERTED", "categories": {"product": 0.6667, "shop": 0.0, "voucher": 0.5}, "changes": "Changed `use_keyword_query_for_multi=True` to `False` in `_handle_voucher_search` so voucher products are scored against the full query (same as product tasks), enabling size/color/model bonuses in `_", "timestamp": "2026-04-28 08:04:19"}
{"iteration": 7, "score": 0.5714, "best": 0.5714, "eval_type": "SAMPLE", "status": "REVERTED", "categories": {"product": 0.6667, "shop": 0.5, "voucher": 0.5}, "changes": "Changed the extraction prompt to preserve explicit product price ranges in voucher tasks instead of always overwriting with `\"0-{budget_ceiling}\"` — this fixes the bug where the agent searches `0-N`", "timestamp": "2026-04-28 08:14:27"}
{"iteration": 8, "score": 0.5714, "best": 0.5714, "eval_type": "SAMPLE", "status": "REVERTED", "categories": {"product": 0.3333, "shop": 1.0, "voucher": 0.5}, "changes": "Increased `MAX_DETAIL_LOOKUP_PRODUCTS` from 20 to 30 to match `TOP_RELEVANCE_CANDIDATES`, ensuring all 30 relevance candidates get attribute-enriched scoring (detail fetch is a single batched API call", "timestamp": "2026-04-28 08:20:16"}
{"iteration": 9, "score": 0.4286, "best": 0.5714, "eval_type": "SAMPLE", "status": "REVERTED", "categories": {"product": 0.3333, "shop": 0.5, "voucher": 0.5}, "changes": "Added a service post-filter in `_handle_single_product` after all search pages and the fallback: when a required service (e.g. \"official\", \"COD\") is specified, candidates that don't carry that service", "timestamp": "2026-04-28 08:26:05"}
{"iteration": 10, "score": 0.2667, "best": 0.5714, "eval_type": "FULL", "status": "REVERTED", "categories": {"product": 0.4, "shop": 0.4, "voucher": 0.0}, "changes": "Fixed `_enrich_voucher_product_params` to always apply the code-derived per-product price ceiling (`gross_budget / n_products`) instead of keeping the LLM's \"0-X\" ceiling when it was more permissive �", "timestamp": "2026-04-28 08:44:29"}
{"iteration": 11, "score": 0.4286, "best": 0.5714, "eval_type": "SAMPLE", "status": "REVERTED", "categories": {"product": 0.6667, "shop": 0.0, "voucher": 0.5}, "changes": "Added page 4 to `_collect_broad_shop_results` to expand the candidate shop discovery pool from 30 to 40 products per spec, increasing the chance of finding the correct shop for same-shop tasks before ", "timestamp": "2026-04-28 08:49:01"}
{"iteration": 12, "score": 0.5714, "best": 0.5714, "eval_type": "SAMPLE", "status": "REVERTED", "categories": {"product": 0.6667, "shop": 1.0, "voucher": 0.0}, "changes": "Increased `extra_pages` from 1 to 2 in `_handle_voucher_search` so voucher tasks now search pages 1–3 (matching product task behavior), giving more candidates for the relevance scorer to find the co", "timestamp": "2026-04-28 08:56:33"}
{"iteration": 13, "score": 0.2857, "best": 0.5714, "eval_type": "SAMPLE", "status": "REVERTED", "categories": {"product": 0.3333, "shop": 0.5, "voucher": 0.0}, "changes": "Expanded `_derive_voucher_price_ceiling` with more budget extraction patterns (\"spend up to X\", \"max of X\", \"up to X PHP\") and more discount patterns (\"% coupon\", \"percent off\", \"voucher of PHP X\"), s", "timestamp": "2026-04-28 09:04:23"}
{"iteration": 14, "score": 0.2857, "best": 0.5714, "eval_type": "SAMPLE", "status": "REVERTED", "categories": {"product": 0.0, "shop": 1.0, "voucher": 0.0}, "changes": "Added `check_product_match` verification in `_handle_single_product`: after keyword-relevance scoring selects the top-3 candidates, the agent now calls `check_product_match` on the top-2 to find the f", "timestamp": "2026-04-28 09:12:45"}
{"iteration": 15, "score": 0.2667, "best": 0.5714, "eval_type": "FULL", "status": "REVERTED", "categories": {"product": 0.4, "shop": 0.3, "voucher": 0.1}, "changes": "Routed single-product voucher tasks through `_handle_single_product` (with budget-derived price ceiling applied via `enriched_params`), giving them the same 3-page search and full-query relevance scor", "timestamp": "2026-04-28 09:34:18"}
{"iteration": 16, "score": 0.7143, "best": 0.7143, "eval_type": "SAMPLE", "status": "KEPT", "categories": {"product": 0.6667, "shop": 1.0, "voucher": 0.5}, "changes": "Increased `extra_pages` from 1 to 2 in `_handle_voucher_search` so voucher tasks now search pages 1–3 (30 candidates), matching the product task search depth and giving the relevance scorer a larger", "timestamp": "2026-04-28 09:42:21"}
{"iteration": 17, "score": 0.7143, "best": 0.7143, "eval_type": "SAMPLE", "status": "REVERTED", "categories": {"product": 0.6667, "shop": 1.0, "voucher": 0.5}, "changes": "For single-product voucher tasks, switched relevance scoring from keywords-only to the full query (since `budget`/`voucher`/`discount` are stopwords), so attributes like color or exact model that LLM ", "timestamp": "2026-04-28 09:47:50"}
{"iteration": 18, "score": 0.1429, "best": 0.7143, "eval_type": "SAMPLE", "status": "REVERTED", "categories": {"product": 0.3333, "shop": 0.0, "voucher": 0.0}, "changes": "Increased voucher search depth from 3 pages (extra_pages=2) to 4 pages (extra_pages=3), giving 40 candidates instead of 30 — extending the proven pattern from iteration 16 that improved voucher from", "timestamp": "2026-04-28 09:55:38"}
{"iteration": 19, "score": 0.2857, "best": 0.7143, "eval_type": "SAMPLE", "status": "REVERTED", "categories": {"product": 0.3333, "shop": 0.0, "voucher": 0.5}, "changes": "Increased `MAX_DETAIL_LOOKUP_PRODUCTS` from 20 to 30 so all 30 top-candidate products get attribute/SKU details fetched during re-scoring, eliminating the blind spot where candidates ranked 21–30 by", "timestamp": "2026-04-28 10:03:55"}
{"iteration": 20, "score": 0.3, "best": 0.7143, "eval_type": "FULL", "status": "REVERTED", "categories": {"product": 0.4, "shop": 0.2, "voucher": 0.3}, "changes": "Added a conditional page-4 search in `_handle_single_product`: when page 3 returns a full 10-result page (indicating more products exist), also fetch page 4 to give the relevance scorer up to 40 candi", "timestamp": "2026-04-28 10:27:34"}
{"iteration": 21, "score": 0.4286, "best": 0.7143, "eval_type": "SAMPLE", "status": "REVERTED", "categories": {"product": 0.6667, "shop": 0.5, "voucher": 0.0}, "changes": "For single-product voucher tasks, switched relevance scoring from LLM keywords-only to the product-description portion of the query (budget/discount sentence stripped), so color, material, and size wo", "timestamp": "2026-04-28 10:37:44"}
{"iteration": 22, "score": 0.5714, "best": 0.7143, "eval_type": "SAMPLE", "status": "REVERTED", "categories": {"product": 0.3333, "shop": 1.0, "voucher": 0.5}, "changes": "Increased `MAX_SHOPS_WIDE_QUERY` from 6→10 and `MAX_SHOPS_FOR_TWO_OR_FEWER_SPECS` from 8→12 to try more candidate shops per task, targeting the shop category's 0.2 full-eval score where the correc", "timestamp": "2026-04-28 10:45:44"}
{"iteration": 23, "score": 0.4286, "best": 0.7143, "eval_type": "SAMPLE", "status": "REVERTED", "categories": {"product": 0.3333, "shop": 0.5, "voucher": 0.5}, "changes": "For product tasks, switched relevance scoring from the full raw query to the LLM-extracted keywords, eliminating score noise from price ranges and service terms (e.g. \"200 pesos\", \"free shipping\", \"la", "timestamp": "2026-04-28 10:53:26"}
{"iteration": 24, "score": 0.4286, "best": 0.7143, "eval_type": "SAMPLE", "status": "REVERTED", "categories": {"product": 0.3333, "shop": 0.5, "voucher": 0.5}, "changes": "In `_score_shop_coverage`, flipped scoring priority from full original query to per-spec extracted keywords (`specs[index].get(\"q\")` first), so each spec's candidate products are scored against their ", "timestamp": "2026-04-28 10:59:03"}
{"iteration": 25, "score": 0.3333, "best": 0.7143, "eval_type": "FULL", "status": "REVERTED", "categories": {"product": 0.4, "shop": 0.4, "voucher": 0.2}, "changes": "Added page 2 fetching to both targeted shop-specific search fallbacks in `_pick_products_for_shop`, so when a candidate shop's matching product appears on page 2 of the shop-scoped search (rather than", "timestamp": "2026-04-28 11:21:56"}
{"iteration": 26, "score": 0.4286, "best": 0.7143, "eval_type": "SAMPLE", "status": "REVERTED", "categories": {"product": 0.3333, "shop": 1.0, "voucher": 0.0}, "changes": "In `_pick_products_for_shop`, changed `spec.get(\"q\", \"\")` to `spec.get(\"keywords\") or spec.get(\"q\", \"\")` so each spec's candidate products are scored against their own LLM-extracted keywords (e.g., \"w", "timestamp": "2026-04-28 11:30:16"}
{"iteration": 27, "score": 0.1429, "best": 0.7143, "eval_type": "SAMPLE", "status": "REVERTED", "categories": {"product": 0.3333, "shop": 0.0, "voucher": 0.0}, "changes": "Added service post-filtering in `_handle_single_product` so that even if the API's service filter passes products missing required tags (e.g. `official`, `COD`), we only score/select from correctly-ta", "timestamp": "2026-04-28 11:43:26"}
{"iteration": 28, "score": 0.4286, "best": 0.7143, "eval_type": "SAMPLE", "status": "REVERTED", "categories": {"product": 0.3333, "shop": 0.5, "voucher": 0.5}, "changes": "For multi-product voucher tasks, increased the per-product price ceiling by 50% (capped at the full gross budget) so that products with unequal pricing (e.g. a 300+700 split vs an equal 500+500 split)", "timestamp": "2026-04-28 11:52:58"}
{"iteration": 29, "score": 0.2857, "best": 0.7143, "eval_type": "SAMPLE", "status": "REVERTED", "categories": {"product": 0.3333, "shop": 0.5, "voucher": 0.0}, "changes": "In `_handle_single_product`, changed relevance scoring to use the LLM-extracted `keywords` (brand + model/type, 2-5 focused words) instead of the full `query`, so price/service/filler text in the raw ", "timestamp": "2026-04-28 11:57:31"}
{"iteration": 30, "score": 0.2333, "best": 0.7143, "eval_type": "FULL", "status": "REVERTED", "categories": {"product": 0.4, "shop": 0.2, "voucher": 0.1}, "changes": "Changed `_derive_voucher_price_ceiling` to use the full pre-discount `gross_budget` as the per-product price ceiling (instead of dividing by `n_products`), allowing multi-product voucher searches to f", "timestamp": "2026-04-28 12:18:20"}
{"iteration": 31, "score": 0.4286, "best": 0.7143, "eval_type": "SAMPLE", "status": "REVERTED", "categories": {"product": 0.6667, "shop": 0.5, "voucher": 0.0}, "changes": "Changed `use_keyword_query_for_multi=True` to `False` in `_handle_voucher_search` (both the primary and fallback calls) so voucher tasks score candidates against the full query instead of just 2-5 LLM", "timestamp": "2026-04-28 12:26:13"}
{"iteration": 32, "score": 0.2857, "best": 0.7143, "eval_type": "SAMPLE", "status": "REVERTED", "categories": {"product": 0.3333, "shop": 0.5, "voucher": 0.0}, "changes": "Removed the price filter from `_collect_broad_shop_results` so shop discovery casts a wider net — shops carrying the right product types at slightly different prices than the LLM estimated are no lo", "timestamp": "2026-04-28 12:33:03"}
{"iteration": 33, "score": 0.2857, "best": 0.7143, "eval_type": "SAMPLE", "status": "REVERTED", "categories": {"product": 0.6667, "shop": 0.0, "voucher": 0.0}, "changes": "For single-product voucher tasks, changed relevance scoring from per-product keywords to the full query (matching `_handle_single_product` behavior), so attributes like model numbers, colors, and size", "timestamp": "2026-04-28 12:39:11"}
{"iteration": 34, "score": 0.4286, "best": 0.7143, "eval_type": "SAMPLE", "status": "REVERTED", "categories": {"product": 0.3333, "shop": 1.0, "voucher": 0.0}, "changes": "Updated the LLM extraction prompt to always include color, size, and variant attributes when the user specifies them (expanding keyword limit from 5 to 6 words). Previously the prompt only included th", "timestamp": "2026-04-28 12:49:07"}
{"iteration": 35, "score": 0.3667, "best": 0.7143, "eval_type": "FULL", "status": "REVERTED", "categories": {"product": 0.5, "shop": 0.4, "voucher": 0.2}, "changes": "Added service post-filtering in `_handle_single_product` so that when the fallback search (which drops service from the API call) returns candidates, only products matching the required service constr", "timestamp": "2026-04-28 13:07:50"}
{"iteration": 36, "score": 0.4286, "best": 0.7143, "eval_type": "SAMPLE", "status": "REVERTED", "categories": {"product": 0.6667, "shop": 0.5, "voucher": 0.0}, "changes": "For voucher tasks, scoring candidates against just 2-5 extracted keywords risks picking the wrong variant (missing color/size/model). Using the full query adds noise from budget numbers (e.g. \"2000\", ", "timestamp": "2026-04-28 13:15:31"}
{"iteration": 37, "score": 0.2857, "best": 0.7143, "eval_type": "SAMPLE", "status": "REVERTED", "categories": {"product": 0.3333, "shop": 0.5, "voucher": 0.0}, "changes": "Added \"and any price amounts, budget figures, discount percentages, or voucher terms\" to the keyword extraction guidance — for voucher queries, the LLM prompt's \"verbatim numbers\" instruction could ", "timestamp": "2026-04-28 13:25:29"}
{"iteration": 38, "score": 0.2857, "best": 0.7143, "eval_type": "SAMPLE", "status": "REVERTED", "categories": {"product": 0.3333, "shop": 0.0, "voucher": 0.5}, "changes": "Increased `MAX_DETAIL_LOOKUP_PRODUCTS` from 20 to 30 to match `TOP_RELEVANCE_CANDIDATES`, ensuring all 30 candidate products receive detail-level attribute scoring (not just the top 20), which reduces", "timestamp": "2026-04-28 13:34:21"}
{"iteration": 39, "score": 0.1429, "best": 0.7143, "eval_type": "SAMPLE", "status": "REVERTED", "categories": {"product": 0.3333, "shop": 0.0, "voucher": 0.0}, "changes": "For single-product voucher tasks, use the product-description portion of the query (stripped of budget/discount language) for relevance scoring instead of just the 2-5 extracted keywords — providing", "timestamp": "2026-04-28 13:39:47"}
{"iteration": 40, "score": 0.2667, "best": 0.7143, "eval_type": "FULL", "status": "REVERTED", "categories": {"product": 0.4, "shop": 0.4, "voucher": 0.0}, "changes": "Added page 4 to `_collect_broad_shop_results` to widen the candidate shop pool, giving the same-shop search more products per spec to discover shops that carry all required items.", "timestamp": "2026-04-28 13:56:28"}
{"iteration": 41, "score": 0.4286, "best": 0.7143, "eval_type": "SAMPLE", "status": "REVERTED", "categories": {"product": 0.6667, "shop": 0.0, "voucher": 0.5}, "changes": "Increased `MAX_SHOPS_WIDE_QUERY` from 6 to 8, giving same-shop searches with 3+ product specs 2 more candidate shops to try before giving up — since the correct shop is sometimes ranked 7th or 8th b", "timestamp": "2026-04-28 14:07:16"}
{"iteration": 42, "score": 0.4286, "best": 0.7143, "eval_type": "SAMPLE", "status": "REVERTED", "categories": {"product": 0.6667, "shop": 0.5, "voucher": 0.0}, "changes": "Changed `_score_shop_coverage` to use per-spec keywords as the primary scoring query (falling back to original query if empty), making it consistent with `_pick_products_for_shop` — this prevents cr", "timestamp": "2026-04-28 14:12:36"}
{"iteration": 43, "score": 0.2857, "best": 0.7143, "eval_type": "SAMPLE", "status": "REVERTED", "categories": {"product": 0.3333, "shop": 0.5, "voucher": 0.0}, "changes": "Added page 4 to single product task search, expanding the candidate pool from 30 to up to 40 products before relevance scoring, increasing the chance the correct product is captured when it ranks lowe", "timestamp": "2026-04-28 14:24:25"}
{"iteration": 44, "score": 0.2857, "best": 0.7143, "eval_type": "SAMPLE", "status": "REVERTED", "categories": {"product": 0.3333, "shop": 0.5, "voucher": 0.0}, "changes": "Increased `MAX_DETAIL_LOOKUP_PRODUCTS` from 20 to 30 so all top-30 candidates get attribute/SKU details fetched before final relevance scoring, preventing the correct product from being missed when it", "timestamp": "2026-04-28 14:39:24"}
{"iteration": 45, "score": 0.2667, "best": 0.7143, "eval_type": "FULL", "status": "REVERTED", "categories": {"product": 0.4, "shop": 0.3, "voucher": 0.1}, "changes": "For multi-product voucher tasks, the previous logic used the LLM's ceiling when it was higher than the code-derived per-product ceiling — but the LLM sometimes provides the undivided gross budget (e", "timestamp": "2026-04-28 14:59:42"}
{"iteration": 46, "score": 0.4286, "best": 0.7143, "eval_type": "SAMPLE", "status": "REVERTED", "categories": {"product": 0.6667, "shop": 0.5, "voucher": 0.0}, "changes": "Extended the discount-detection regexes in `_derive_voucher_price_ceiling` to match \"percent\" (not just \"%\") and \"coupon\"/\"voucher\" as trailing discount words — previously these phrasings would leav", "timestamp": "2026-04-28 15:15:54"}
