{"iteration": 0, "score": 0.2857, "best": 0.2857, "eval_type": "BASELINE", "status": "BASELINE", "timestamp": "2026-04-25 07:02:58"}
{"iteration": 1, "score": 0.4286, "best": 0.4286, "eval_type": "SAMPLE", "status": "KEPT", "categories": {"product": 0.6667, "shop": 0.5, "voucher": 0.0}, "changes": "Tightened the LLM keyword extraction prompt from \"3-8 words\" to \"2-5 words: brand + specific model/type\" with emphasis on exact model names and numbers, aligning with the system guidance that Lucene s", "timestamp": "2026-04-25 07:08:50"}
{"iteration": 2, "score": 0.4286, "best": 0.4286, "eval_type": "SAMPLE", "status": "REVERTED", "categories": {"product": 0.3333, "shop": 0.5, "voucher": 0.5}, "changes": "For single-product voucher tasks, switched relevance scoring from extracted keywords to the full query (matching how `_handle_single_product` works for product tasks), since the 0.0 voucher score sugg", "timestamp": "2026-04-25 07:15:10"}
{"iteration": 3, "score": 0.5714, "best": 0.5714, "eval_type": "SAMPLE", "status": "KEPT", "categories": {"product": 0.6667, "shop": 0.5, "voucher": 0.5}, "changes": "Added a specific instruction to `_EXTRACTION_PROMPT` telling the LLM to always compute `price_range` from budget + discount for voucher tasks â€” fixing the root cause of the 0.0 voucher score: withou", "timestamp": "2026-04-25 07:20:56"}
{"iteration": 4, "score": 0.1429, "best": 0.5714, "eval_type": "SAMPLE", "status": "REVERTED", "categories": {"product": 0.3333, "shop": 0.0, "voucher": 0.0}, "changes": "Added page 2 fetching to `_collect_broad_shop_results` so the broad shop-discovery phase covers up to 20 products per spec instead of 10, doubling the pool of candidate shops and improving the chance ", "timestamp": "2026-04-25 07:25:13"}
{"iteration": 5, "score": 0.3, "best": 0.5714, "eval_type": "FULL", "status": "REVERTED", "categories": {"product": 0.4, "shop": 0.3, "voucher": 0.2}, "changes": "In `_score_shop_coverage`, swapped priority from full `original_query` to spec-specific `q` keywords when scoring candidate shops â€” previously, a multi-product shop query always scored all specs aga", "timestamp": "2026-04-25 07:42:58"}
{"iteration": 6, "score": 0.5714, "best": 0.5714, "eval_type": "SAMPLE", "status": "REVERTED", "categories": {"product": 0.6667, "shop": 0.5, "voucher": 0.5}, "changes": "For single-product voucher tasks, switched relevance scoring from extracted keywords to the full query (matching `_handle_single_product`), so that product attributes like color/size/material explicit", "timestamp": "2026-04-25 07:52:13"}
{"iteration": 7, "score": 0.5714, "best": 0.5714, "eval_type": "SAMPLE", "status": "REVERTED", "categories": {"product": 0.6667, "shop": 0.5, "voucher": 0.5}, "changes": "Replaced the unconstrained shop fallback with `_shop_constrained_fallback`: when `find_products_in_same_shop` fails, it now anchors to the first spec's best result's shop_id and searches all remaining", "timestamp": "2026-04-25 07:59:55"}
{"iteration": 8, "score": 0.2857, "best": 0.5714, "eval_type": "SAMPLE", "status": "REVERTED", "categories": {"product": 0.6667, "shop": 0.0, "voucher": 0.0}, "changes": "Changed the voucher price ceiling to use the full `gross_budget` for each product instead of dividing by `n_products` â€” the divided ceiling was too restrictive for multi-product tasks and could excl", "timestamp": "2026-04-25 08:06:38"}
{"iteration": 9, "score": 0.2857, "best": 0.5714, "eval_type": "SAMPLE", "status": "REVERTED", "categories": {"product": 0.6667, "shop": 0.0, "voucher": 0.0}, "changes": "Changed the LLM extraction prompt so that color, material, and size are always included in keywords when explicitly mentioned (previously only \"if essential to product identity\"). This makes search qu", "timestamp": "2026-04-25 08:15:25"}
{"iteration": 10, "score": 0.3, "best": 0.5714, "eval_type": "FULL", "status": "REVERTED", "categories": {"product": 0.6, "shop": 0.2, "voucher": 0.1}, "changes": "Added page 2 fetching to `_collect_broad_shop_results` to double the candidate shop pool (from 10 to up to 20 products per spec), increasing the chance of finding a single shop that carries all requir", "timestamp": "2026-04-25 08:33:34"}
{"iteration": 11, "score": 0.5714, "best": 0.5714, "eval_type": "SAMPLE", "status": "REVERTED", "categories": {"product": 0.6667, "shop": 0.5, "voucher": 0.5}, "changes": "Added a retry of `find_products_in_same_shop` without price filters when the initial same-shop search fails â€” price constraints in the broad search can exclude shops that carry all required items, s", "timestamp": "2026-04-25 08:46:47"}
{"iteration": 12, "score": 0.4286, "best": 0.5714, "eval_type": "SAMPLE", "status": "REVERTED", "categories": {"product": 0.3333, "shop": 0.5, "voucher": 0.5}, "changes": "Increased `MAX_SHOPS_WIDE_QUERY` from 6â†’10 and `MAX_SHOPS_FOR_TWO_OR_FEWER_SPECS` from 8â†’14 so the same-shop search tries more candidate shops before giving up â€” catching valid shops ranked 7th-", "timestamp": "2026-04-25 08:55:58"}
{"iteration": 13, "score": 0.2857, "best": 0.5714, "eval_type": "SAMPLE", "status": "REVERTED", "categories": {"product": 0.3333, "shop": 0.5, "voucher": 0.0}, "changes": "Re-applied iteration 11's winning change: when `find_products_in_same_shop` fails on a shop task, retry without price filters before falling back to individual searches â€” price constraints in the in", "timestamp": "2026-04-25 08:59:36"}
{"iteration": 14, "score": 0.1429, "best": 0.5714, "eval_type": "SAMPLE", "status": "REVERTED", "categories": {"product": 0.3333, "shop": 0.0, "voucher": 0.0}, "changes": "Added a third phase to `find_products_in_same_shop` that strips price from the broad discovery search (to surface shops that carry all required items regardless of price tier), while passing empty cov", "timestamp": "2026-04-25 09:08:31"}
{"iteration": 15, "score": 0.3, "best": 0.5714, "eval_type": "FULL", "status": "REVERTED", "categories": {"product": 0.5, "shop": 0.2, "voucher": 0.2}, "changes": "Removed the \"divide by number of products\" constraint from both the LLM extraction prompt and the enrichment fallback â€” for multi-item voucher tasks, each product is now searched up to the full gros", "timestamp": "2026-04-25 09:27:58"}
{"iteration": 16, "score": 0.1429, "best": 0.5714, "eval_type": "SAMPLE", "status": "REVERTED", "categories": {"product": 0.3333, "shop": 0.0, "voucher": 0.0}, "changes": "Added page 3 fetching to the product task search: when pages 1+2 return results, also fetch page 3 to widen the candidate pool from 20 to up to 30 products, giving the title-based relevance scorer mor", "timestamp": "2026-04-25 09:37:12"}
{"iteration": 17, "score": 0.5714, "best": 0.5714, "eval_type": "SAMPLE", "status": "REVERTED", "categories": {"product": 0.6667, "shop": 0.5, "voucher": 0.5}, "changes": "Added page 2 fetching to the broad shop discovery phase so `_collect_broad_shop_results` discovers twice as many candidate shops per spec, surfacing valid shops whose products appear beyond the first ", "timestamp": "2026-04-25 09:42:19"}
{"iteration": 18, "score": 0.4286, "best": 0.5714, "eval_type": "SAMPLE", "status": "REVERTED", "categories": {"product": 0.6667, "shop": 0.0, "voucher": 0.5}, "changes": "In `_score_shop_coverage`, flipped the query priority from full-query-first to spec-keywords-first â€” for multi-product shop tasks, scoring each spec's candidate products against that spec's own extr", "timestamp": "2026-04-25 09:49:06"}
{"iteration": 19, "score": 0.4286, "best": 0.5714, "eval_type": "SAMPLE", "status": "REVERTED", "categories": {"product": 0.3333, "shop": 0.5, "voucher": 0.5}, "changes": "Re-applied the page 2 fetching to `_collect_broad_shop_results` so same-shop discovery considers twice as many candidate shops per spec, which was the change that achieved the best score (0.5714) in i", "timestamp": "2026-04-25 09:52:55"}
{"iteration": 20, "score": 0.3, "best": 0.5714, "eval_type": "FULL", "status": "REVERTED", "categories": {"product": 0.6, "shop": 0.1, "voucher": 0.2}, "changes": "Omitted price filtering from `_collect_broad_shop_results` so the broad shop-discovery phase surfaces more candidate shops (price constraints are still enforced per-shop in `_pick_products_for_shop`),", "timestamp": "2026-04-25 10:07:42"}
{"iteration": 21, "score": 0.2857, "best": 0.5714, "eval_type": "SAMPLE", "status": "REVERTED", "categories": {"product": 0.6667, "shop": 0.0, "voucher": 0.0}, "changes": "Added page 2 fetching to `_collect_broad_shop_results` so the broad shop-discovery phase surfaces twice as many candidate shops per spec, which was the change that achieved the best score (0.5714) in ", "timestamp": "2026-04-25 10:11:34"}
{"iteration": 22, "score": 0.5714, "best": 0.5714, "eval_type": "SAMPLE", "status": "REVERTED", "categories": {"product": 0.6667, "shop": 0.5, "voucher": 0.5}, "changes": "Removed the per-product budget division in `_derive_voucher_price_ceiling` and updated the LLM prompt â€” for multi-item voucher tasks, each product now gets the full gross-budget ceiling instead of `", "timestamp": "2026-04-25 10:19:40"}
{"iteration": 23, "score": 0.2857, "best": 0.5714, "eval_type": "SAMPLE", "status": "REVERTED", "categories": {"product": 0.3333, "shop": 0.5, "voucher": 0.0}, "changes": "When the first same-shop search fails, retry `find_products_in_same_shop` with shortened 2-word keywords per spec â€” this surfaces larger/more diverse candidate shops that full-length queries might m", "timestamp": "2026-04-25 10:32:54"}
{"iteration": 24, "score": 0.2857, "best": 0.5714, "eval_type": "SAMPLE", "status": "REVERTED", "categories": {"product": 0.3333, "shop": 0.0, "voucher": 0.5}, "changes": "Increased `MAX_SHOPS_WIDE_QUERY` from 6â†’10 and `MAX_SHOPS_FOR_TWO_OR_FEWER_SPECS` from 8â†’12 so the same-shop search considers 4 more candidate shops per phase, directly targeting the 50% shop task", "timestamp": "2026-04-25 10:40:50"}
{"iteration": 25, "score": 0.3333, "best": 0.5714, "eval_type": "FULL", "status": "REVERTED", "categories": {"product": 0.5, "shop": 0.3, "voucher": 0.2}, "changes": "Changed `_collect_broad_shop_results` to fetch both page 1 and page 2 for each search spec, doubling the candidate shop pool from 10 to up to 20 products per spec so that more shops are discovered dur", "timestamp": "2026-04-25 10:58:59"}
{"iteration": 26, "score": 0.4286, "best": 0.5714, "eval_type": "SAMPLE", "status": "REVERTED", "categories": {"product": 0.6667, "shop": 0.0, "voucher": 0.5}, "changes": "Changed `use_keyword_query_for_multi` from always `True` to `len(products) > 1` in `_handle_voucher_search`: single-product voucher tasks now score candidates against the full query (capturing color/s", "timestamp": "2026-04-25 11:05:32"}
{"iteration": 27, "score": 0.2857, "best": 0.5714, "eval_type": "SAMPLE", "status": "REVERTED", "categories": {"product": 0.3333, "shop": 0.0, "voucher": 0.5}, "changes": "Changed `_score_shop_coverage` to use spec-specific keywords (not the full multi-product query) when ranking candidate shops â€” this removes cross-spec keyword noise so shop A's products aren't score", "timestamp": "2026-04-25 11:13:23"}
{"iteration": 28, "score": 0.2857, "best": 0.5714, "eval_type": "SAMPLE", "status": "REVERTED", "categories": {"product": 0.3333, "shop": 0.0, "voucher": 0.5}, "changes": "Added a `-4.0` penalty to relevance scoring when the query specifies a color (e.g., \"red\") but the product title contains a *different* specific color (e.g., \"Black Chair\") â€” this reduces wrong-colo", "timestamp": "2026-04-25 11:21:46"}
{"iteration": 29, "score": 0.4286, "best": 0.5714, "eval_type": "SAMPLE", "status": "REVERTED", "categories": {"product": 0.3333, "shop": 0.5, "voucher": 0.5}, "changes": "Removed price filtering from the broad shop discovery phase (`_collect_broad_shop_results`). Price constraints were preventing shops from being discovered if their products didn't surface in price-fil", "timestamp": "2026-04-25 11:29:41"}
{"iteration": 30, "score": 0.2667, "best": 0.5714, "eval_type": "FULL", "status": "REVERTED", "categories": {"product": 0.4, "shop": 0.3, "voucher": 0.1}, "changes": "For single-product voucher tasks, switched from keyword-only scoring to full-query scoring so that color, size, and other attribute details in the original query improve product selection â€” multi-pr", "timestamp": "2026-04-25 11:48:06"}
{"iteration": 31, "score": 0.4286, "best": 0.5714, "eval_type": "SAMPLE", "status": "REVERTED", "categories": {"product": 0.6667, "shop": 0.5, "voucher": 0.0}, "changes": "Added page 2 fetching to `_collect_broad_shop_results` so the broad shop discovery phase sees up to 20 products per spec instead of 10, doubling the candidate shops discovered and improving the chance", "timestamp": "2026-04-25 11:52:00"}
{"iteration": 32, "score": 0.4286, "best": 0.5714, "eval_type": "SAMPLE", "status": "REVERTED", "categories": {"product": 0.6667, "shop": 0.5, "voucher": 0.0}, "changes": "Changed \"Include color/size only if essential to product identity\" to \"Always include color/size/material/capacity when explicitly stated in the query\" â€” this ensures the LLM embeds specific product", "timestamp": "2026-04-25 12:00:38"}
{"iteration": 33, "score": 0.2857, "best": 0.5714, "eval_type": "SAMPLE", "status": "REVERTED", "categories": {"product": 0.3333, "shop": 0.5, "voucher": 0.0}, "changes": "Added individual word indexing for multi-word attribute values (e.g. \"Navy Blue\" now contributes \"navy\" and \"blue\" to `exact_values`), so query words matching any word in a multi-word color/size/mater", "timestamp": "2026-04-25 12:08:05"}
{"iteration": 34, "score": 0.4286, "best": 0.5714, "eval_type": "SAMPLE", "status": "REVERTED", "categories": {"product": 0.3333, "shop": 0.5, "voucher": 0.5}, "changes": "Added a per-product price-filter retry in `_search_products_individually`: when a price-filtered search returns zero results for an individual product, the agent now retries without the price constrai", "timestamp": "2026-04-25 12:14:56"}
{"iteration": 35, "score": 0.3667, "best": 0.5714, "eval_type": "FULL", "status": "REVERTED", "categories": {"product": 0.6, "shop": 0.4, "voucher": 0.1}, "changes": "Added a price-filter retry in `_search_products_individually`: when a price-filtered search returns empty results, the agent now retries without the price constraint, so voucher tasks can still find a", "timestamp": "2026-04-25 12:30:40"}
{"iteration": 36, "score": 0.4286, "best": 0.5714, "eval_type": "SAMPLE", "status": "REVERTED", "categories": {"product": 0.6667, "shop": 0.5, "voucher": 0.0}, "changes": "Changed the `_EXTRACTION_PROMPT` to instruct the LLM to leave `price_range` as null for voucher tasks instead of computing it â€” this ensures `_enrich_voucher_product_params` always runs its reliable", "timestamp": "2026-04-25 12:39:00"}
{"iteration": 37, "score": 0.2857, "best": 0.5714, "eval_type": "SAMPLE", "status": "REVERTED", "categories": {"product": 0.3333, "shop": 0.5, "voucher": 0.0}, "changes": "Added `per_product_price_fallback=True` exclusively to `_handle_voucher_search`: when a price-ceiling-filtered search returns zero results for a specific voucher product, the agent now retries that pr", "timestamp": "2026-04-25 12:45:00"}
{"iteration": 38, "score": 0.1429, "best": 0.5714, "eval_type": "SAMPLE", "status": "REVERTED", "categories": {"product": 0.3333, "shop": 0.0, "voucher": 0.0}, "changes": "Added page 2 fetching to `_collect_broad_shop_results` so the broad shop discovery phase searches 20 products per spec instead of 10, increasing the chance of finding a shop that carries all required ", "timestamp": "2026-04-25 12:51:28"}
{"iteration": 39, "score": 0.4286, "best": 0.5714, "eval_type": "SAMPLE", "status": "REVERTED", "categories": {"product": 0.6667, "shop": 0.0, "voucher": 0.5}, "changes": "Changed the per-product voucher price ceiling from `gross_budget / N` to `gross_budget`, and made enrichment always override the LLM's price_range â€” fixing the bug where multi-product voucher tasks ", "timestamp": "2026-04-25 13:02:40"}
{"iteration": 40, "score": 0.3667, "best": 0.5714, "eval_type": "FULL", "status": "REVERTED", "categories": {"product": 0.7, "shop": 0.3, "voucher": 0.1}, "changes": "Increased `MAX_SHOPS_WIDE_QUERY` from 6â†’10 and `MAX_SHOPS_FOR_TWO_OR_FEWER_SPECS` from 8â†’12 so the same-shop search tries more candidate shops before falling back to individual searches that can n", "timestamp": "2026-04-25 13:24:24"}
{"iteration": 41, "score": 0.4286, "best": 0.5714, "eval_type": "SAMPLE", "status": "REVERTED", "categories": {"product": 0.3333, "shop": 0.5, "voucher": 0.5}, "changes": "Changed `_enrich_voucher_product_params` to apply the code-derived per-product price ceiling as a **cap** even when the LLM already set a `price_range` â€” if the LLM's max exceeds `gross_budget / N`,", "timestamp": "2026-04-25 13:29:32"}
{"iteration": 42, "score": 0.4286, "best": 0.5714, "eval_type": "SAMPLE", "status": "REVERTED", "categories": {"product": 0.6667, "shop": 0.5, "voucher": 0.0}, "changes": "Changed the voucher per-product price ceiling from `gross_budget / N` to `gross_budget` in both the LLM extraction prompt and the Python fallback â€” individual products in a multi-item voucher task c", "timestamp": "2026-04-25 13:36:43"}
{"iteration": 43, "score": 0.5714, "best": 0.5714, "eval_type": "SAMPLE", "status": "REVERTED", "categories": {"product": 0.6667, "shop": 0.5, "voucher": 0.5}, "changes": "Changed `_enrich_voucher_product_params` to always apply the full `gross_budget` (not `gross_budget / N`) as the per-product price ceiling, fixing the too-tight filter that caused multi-product vouche", "timestamp": "2026-04-25 13:42:46"}
{"iteration": 44, "score": 0.4286, "best": 0.5714, "eval_type": "SAMPLE", "status": "REVERTED", "categories": {"product": 0.6667, "shop": 0.5, "voucher": 0.0}, "changes": "Changed `_collect_broad_shop_results` to fetch pages 1 and 2 per spec, doubling the candidate shop pool from ~10 to ~20 products per spec so the same-shop search can discover more potential shops befo", "timestamp": "2026-04-25 13:46:52"}
{"iteration": 45, "score": 0.3667, "best": 0.5714, "eval_type": "FULL", "status": "REVERTED", "categories": {"product": 0.5, "shop": 0.4, "voucher": 0.2}, "changes": "Fixed the voucher price ceiling bug in both places: removed the \"divide by N\" instruction from the LLM extraction prompt and changed `_derive_voucher_price_ceiling` to use `gross_budget` directly inst", "timestamp": "2026-04-25 14:07:15"}
{"iteration": 46, "score": 0.4286, "best": 0.5714, "eval_type": "SAMPLE", "status": "REVERTED", "categories": {"product": 0.6667, "shop": 0.5, "voucher": 0.0}, "changes": "Removed the \"Divide ceil by number of products for multi-item tasks\" instruction from the LLM extraction prompt so each product in a multi-item voucher task gets the full gross budget as its price cei", "timestamp": "2026-04-25 14:16:32"}
{"iteration": 47, "score": 0.5714, "best": 0.5714, "eval_type": "SAMPLE", "status": "REVERTED", "categories": {"product": 0.6667, "shop": 0.5, "voucher": 0.5}, "changes": "Fixed `_derive_voucher_price_ceiling` to use `gross_budget` directly (not divided by `n_products`), so each product in a multi-item voucher task gets the full pre-discount budget as its price ceiling ", "timestamp": "2026-04-25 14:28:23"}
{"iteration": 48, "score": 0.4286, "best": 0.5714, "eval_type": "SAMPLE", "status": "REVERTED", "categories": {"product": 0.3333, "shop": 0.5, "voucher": 0.5}, "changes": "Added page 3 fetch for single product tasks, expanding the candidate pool from ~20 to ~30 products so the relevance scorer has more options to find an accurate title match.", "timestamp": "2026-04-25 14:34:21"}
{"iteration": 49, "score": 0.5714, "best": 0.5714, "eval_type": "SAMPLE", "status": "REVERTED", "categories": {"product": 0.6667, "shop": 0.5, "voucher": 0.5}, "changes": "Fixed `_derive_voucher_price_ceiling` to use `gross_budget` directly instead of dividing by `n_products`, so each product in a multi-item voucher task gets the full pre-discount budget as its price ce", "timestamp": "2026-04-25 14:37:38"}
{"iteration": 50, "score": 0.3, "best": 0.5714, "eval_type": "FULL", "status": "REVERTED", "categories": {"product": 0.5, "shop": 0.2, "voucher": 0.2}, "changes": "Fixed `_derive_voucher_price_ceiling` to use `gross_budget` directly instead of dividing by `n_products`, so each product in a multi-item voucher task gets the full pre-discount budget as its individu", "timestamp": "2026-04-25 14:55:23"}
{"iteration": 51, "score": 0.4286, "best": 0.5714, "eval_type": "SAMPLE", "status": "REVERTED", "categories": {"product": 0.3333, "shop": 0.5, "voucher": 0.5}, "changes": "Added page 2 fetching to `_collect_broad_shop_results` so the broad candidate pool doubles from ~10 to ~20 products per spec, surfacing more shops and improving the chance of finding one that stocks a", "timestamp": "2026-04-25 14:59:58"}
{"iteration": 52, "score": 0.5714, "best": 0.5714, "eval_type": "SAMPLE", "status": "REVERTED", "categories": {"product": 0.6667, "shop": 0.5, "voucher": 0.5}, "changes": "Changed `_score_shop_coverage` to score each spec's candidate products against spec-specific keywords (`specs[index].get(\"q\", \"\") or original_query`) instead of always using the full original query â€", "timestamp": "2026-04-25 15:06:49"}
