{"iteration": 0, "score": 0.4286, "best": 0.4286, "eval_type": "BASELINE", "status": "BASELINE", "timestamp": "2026-04-29 07:03:23"}
{"iteration": 1, "score": 0.4286, "best": 0.4286, "eval_type": "SAMPLE", "status": "REVERTED", "categories": {"product": 0.3333, "shop": 0.5, "voucher": 0.5}, "changes": "Added an intermediate fallback in `_handle_single_product` that retains the service filter but drops the price constraint before falling back to a completely unconstrained search, and post-filters by ", "timestamp": "2026-04-29 07:09:56"}
{"iteration": 2, "score": 0.4286, "best": 0.4286, "eval_type": "SAMPLE", "status": "REVERTED", "categories": {"product": 0.3333, "shop": 0.5, "voucher": 0.5}, "changes": "Updated the extraction prompt to instruct the LLM to include more specific attribute terms (storage, capacity, color, size) in search keywords when users specify them. This should help find products w", "timestamp": "2026-04-29 07:16:46"}
{"iteration": 3, "score": 0.5714, "best": 0.5714, "eval_type": "SAMPLE", "status": "KEPT", "categories": {"product": 0.6667, "shop": 1.0, "voucher": 0.0}, "changes": "Increased shop broad search from 3 pages to 4 pages per spec, giving 33% more candidate shops per item and improving the probability that the correct shop (selling all required items) is discovered in", "timestamp": "2026-04-29 07:25:16"}
{"iteration": 4, "score": 0.5714, "best": 0.5714, "eval_type": "SAMPLE", "status": "REVERTED", "categories": {"product": 0.6667, "shop": 0.5, "voucher": 0.5}, "changes": "Changed `use_keyword_query_for_multi=True` to `False` in `_handle_voucher_search`: voucher relevance scoring now uses the full query (matching the product task approach that scores 0.6667) instead of ", "timestamp": "2026-04-29 07:31:29"}
{"iteration": 5, "score": 0.3667, "best": 0.5714, "eval_type": "FULL", "status": "REVERTED", "categories": {"product": 0.5, "shop": 0.4, "voucher": 0.2}, "changes": "For single-product voucher tasks, route through `_handle_single_product` (which uses full-query scoring over 3 pages and achieves 0.6667 on product tasks) instead of the keyword-scored path that was s", "timestamp": "2026-04-29 07:52:53"}
{"iteration": 6, "score": 0.4286, "best": 0.5714, "eval_type": "SAMPLE", "status": "REVERTED", "categories": {"product": 0.6667, "shop": 0.5, "voucher": 0.0}, "changes": "Changed `use_keyword_query_for_multi=True` to `False` in `_handle_voucher_search` so voucher tasks score candidates using the full query (like the product path that achieves 0.6667) instead of just ex", "timestamp": "2026-04-29 08:00:27"}
{"iteration": 7, "score": 0.5714, "best": 0.5714, "eval_type": "SAMPLE", "status": "REVERTED", "categories": {"product": 0.6667, "shop": 0.5, "voucher": 0.5}, "changes": "Changed `use_keyword_query_for_multi=True` to `False` in `_handle_voucher_search` so voucher candidate scoring uses the full query (matching the product path that achieves 0.6667) instead of the LLM-e", "timestamp": "2026-04-29 08:06:21"}
{"iteration": 8, "score": 0.5714, "best": 0.5714, "eval_type": "SAMPLE", "status": "REVERTED", "categories": {"product": 0.6667, "shop": 0.5, "voucher": 0.5}, "changes": "Changed `use_keyword_query_for_multi=True` to `False` in `_handle_voucher_search` so voucher candidate scoring uses the full query (like the product path that achieves 0.6667) instead of extracted key", "timestamp": "2026-04-29 08:11:36"}
{"iteration": 9, "score": 0.4286, "best": 0.5714, "eval_type": "SAMPLE", "status": "REVERTED", "categories": {"product": 0.3333, "shop": 0.5, "voucher": 0.5}, "changes": "In `_score_shop_coverage`, changed shop ranking to score each spec's product pool against that spec's specific keywords (falling back to the full query) rather than always using the full original quer", "timestamp": "2026-04-29 08:16:35"}
{"iteration": 10, "score": 0.4, "best": 0.5714, "eval_type": "FULL", "status": "REVERTED", "categories": {"product": 0.5, "shop": 0.5, "voucher": 0.2}, "changes": "Added page 5 to `_collect_broad_shop_results` so shop tasks now search 50 products per spec (up from 40), increasing the candidate shop pool and improving the chance of finding a shop that carries all", "timestamp": "2026-04-29 08:36:18"}
{"iteration": 11, "score": 0.7143, "best": 0.7143, "eval_type": "SAMPLE", "status": "KEPT", "categories": {"product": 0.6667, "shop": 1.0, "voucher": 0.5}, "changes": "Removed the per-product division in `_derive_voucher_price_ceiling` so each product searches with the full gross budget as its price ceiling instead of `gross_budget / n_products`, fixing the equal-co", "timestamp": "2026-04-29 08:42:43"}
{"iteration": 12, "score": 0.7143, "best": 0.7143, "eval_type": "SAMPLE", "status": "REVERTED", "categories": {"product": 0.6667, "shop": 1.0, "voucher": 0.5}, "changes": "Restored per-product price ceiling division (`gross_budget / n_products`) for multi-product voucher tasks so the combined product total stays within budget after discount, relying on the existing pric", "timestamp": "2026-04-29 08:50:12"}
{"iteration": 13, "score": 0.7143, "best": 0.7143, "eval_type": "SAMPLE", "status": "REVERTED", "categories": {"product": 0.6667, "shop": 1.0, "voucher": 0.5}, "changes": "Increased `MAX_DETAIL_LOOKUP_PRODUCTS` from 20 to 30 to match `TOP_RELEVANCE_CANDIDATES`, ensuring all top 30 title-scored candidates get attribute-enriched detail scoring instead of only the first 20", "timestamp": "2026-04-29 08:57:34"}
{"iteration": 14, "score": 0.5714, "best": 0.7143, "eval_type": "SAMPLE", "status": "REVERTED", "categories": {"product": 0.3333, "shop": 1.0, "voucher": 0.5}, "changes": "Added page 4 search to `_handle_single_product` so product tasks now collect up to 40 candidates instead of 30, matching the depth already used by the shop search path, increasing the chance that the ", "timestamp": "2026-04-29 09:05:47"}
{"iteration": 15, "score": 0.3667, "best": 0.7143, "eval_type": "FULL", "status": "REVERTED", "categories": {"product": 0.5, "shop": 0.4, "voucher": 0.2}, "changes": "Added a word-coverage bonus in `_score_product_relevance`: products matching ≥80% of query words get +6, ≥60% get +3, amplifying the gap between strong and partial matches so the best product is m", "timestamp": "2026-04-29 09:24:35"}
{"iteration": 16, "score": 0.7143, "best": 0.7143, "eval_type": "SAMPLE", "status": "REVERTED", "categories": {"product": 0.6667, "shop": 1.0, "voucher": 0.5}, "changes": "Added an intermediate fallback in `_handle_single_product` that drops only the service API filter (keeping the price filter) and re-applies service matching post-hoc, mirroring the same-shop search st", "timestamp": "2026-04-29 09:32:07"}
{"iteration": 17, "score": 0.5714, "best": 0.7143, "eval_type": "SAMPLE", "status": "REVERTED", "categories": {"product": 0.6667, "shop": 1.0, "voucher": 0.0}, "changes": "Changed `_enrich_voucher_product_params` to use `min(LLM_ceiling, code_ceiling)` instead of `max` — the LLM prompt already instructs it to divide the gross budget by n_products for multi-item vouche", "timestamp": "2026-04-29 09:39:44"}
{"iteration": 18, "score": 0.5714, "best": 0.7143, "eval_type": "SAMPLE", "status": "REVERTED", "categories": {"product": 0.6667, "shop": 0.5, "voucher": 0.5}, "changes": "Fixed `_derive_voucher_price_ceiling` to divide `gross_budget` by `n_products` for multi-product voucher tasks, so the per-product price ceiling is correctly `budget / n_products` instead of the full ", "timestamp": "2026-04-29 09:43:59"}
{"iteration": 19, "score": 0.5714, "best": 0.7143, "eval_type": "SAMPLE", "status": "REVERTED", "categories": {"product": 0.3333, "shop": 1.0, "voucher": 0.5}, "changes": "For single-product voucher tasks, switched from scoring with extracted keywords to scoring with the full query (matching how `_handle_single_product` works), which gives richer signal for title simila", "timestamp": "2026-04-29 09:57:48"}
{"iteration": 20, "score": 0.3667, "best": 0.7143, "eval_type": "FULL", "status": "REVERTED", "categories": {"product": 0.5, "shop": 0.4, "voucher": 0.2}, "changes": "Increased `MAX_DETAIL_LOOKUP_PRODUCTS` from 20 to 30 so all `TOP_RELEVANCE_CANDIDATES` get attribute-enriched detail scoring before final selection, preventing good-attribute/mediocre-title products r", "timestamp": "2026-04-29 10:19:21"}
{"iteration": 21, "score": 0.5714, "best": 0.7143, "eval_type": "SAMPLE", "status": "REVERTED", "categories": {"product": 0.6667, "shop": 0.5, "voucher": 0.5}, "changes": "For multi-product voucher tasks, `_derive_voucher_price_ceiling` now divides `gross_budget` by `n_products` to give a proper per-product ceiling, and `_enrich_voucher_product_params` always enforces t", "timestamp": "2026-04-29 10:32:23"}
{"iteration": 22, "score": 0.7143, "best": 0.7143, "eval_type": "SAMPLE", "status": "REVERTED", "categories": {"product": 0.6667, "shop": 1.0, "voucher": 0.5}, "changes": "Changed `_handle_single_product` to use a staged fallback: when initial pages return empty and both price and service filters were active, first retry keeping service but dropping price — only dropp", "timestamp": "2026-04-29 10:38:42"}
{"iteration": 23, "score": 0.5714, "best": 0.7143, "eval_type": "SAMPLE", "status": "REVERTED", "categories": {"product": 0.6667, "shop": 0.5, "voucher": 0.5}, "changes": "For single-product voucher tasks, switched scoring from extracted keywords to the full query so the evaluator's semantic title-similarity check gets richer signal (stopwords like \"voucher\"/\"budget\" ar", "timestamp": "2026-04-29 10:45:38"}
{"iteration": 24, "score": 0.1429, "best": 0.7143, "eval_type": "SAMPLE", "status": "REVERTED", "categories": {"product": 0.3333, "shop": 0.0, "voucher": 0.0}, "changes": "Re-implemented the staged fallback from iteration 22: when initial pages return empty and both price and service filters were active, first retry keeping service but dropping price — only dropping b", "timestamp": "2026-04-29 10:49:47"}
{"iteration": 25, "score": 0.4, "best": 0.7143, "eval_type": "FULL", "status": "REVERTED", "categories": {"product": 0.5, "shop": 0.5, "voucher": 0.2}, "changes": "Staged fallback in `_handle_single_product`: when both price AND service filters were active and pages 1-3 return empty, first retry keeping service (drop price only), then retry with no filters — t", "timestamp": "2026-04-29 11:12:34"}
{"iteration": 26, "score": 0.5714, "best": 0.7143, "eval_type": "SAMPLE", "status": "REVERTED", "categories": {"product": 0.6667, "shop": 0.5, "voucher": 0.5}, "changes": "Added a 5th page fetch per spec in `_collect_broad_shop_results` (up from 4), giving 50 candidate products per spec instead of 40 to increase the chance of discovering shops that stock all required it", "timestamp": "2026-04-29 11:23:03"}
{"iteration": 27, "score": 0.2857, "best": 0.7143, "eval_type": "SAMPLE", "status": "REVERTED", "categories": {"product": 0.3333, "shop": 0.0, "voucher": 0.5}, "changes": "Added page 4 fetch in `_handle_single_product` to expand the candidate pool from up to 30 to up to 40 products, giving the relevance scorer more options to find the best-matching product for the ~33% ", "timestamp": "2026-04-29 11:30:03"}
{"iteration": 28, "score": 0.4286, "best": 0.7143, "eval_type": "SAMPLE", "status": "REVERTED", "categories": {"product": 0.3333, "shop": 1.0, "voucher": 0.0}, "changes": "Fixed bug in `_derive_voucher_price_ceiling`: divided gross budget by `n_products` so multi-product voucher tasks get a per-product price ceiling instead of the full total gross budget, preventing sel", "timestamp": "2026-04-29 11:34:17"}
{"iteration": 29, "score": 0.5714, "best": 0.7143, "eval_type": "SAMPLE", "status": "REVERTED", "categories": {"product": 0.3333, "shop": 1.0, "voucher": 0.5}, "changes": "For single-product voucher tasks, switched relevance scoring from LLM-extracted keywords to the full query so that product-specific details (colors, sizes, exact model variants) that the LLM strips fr", "timestamp": "2026-04-29 11:45:11"}
{"iteration": 30, "score": 0.3, "best": 0.7143, "eval_type": "FULL", "status": "REVERTED", "categories": {"product": 0.5, "shop": 0.2, "voucher": 0.2}, "changes": "Increased `MAX_DETAIL_LOOKUP_PRODUCTS` from 20 to 30 to match `TOP_RELEVANCE_CANDIDATES`, ensuring all top-ranked candidates get their attributes fetched for re-scoring — previously the bottom 10 of", "timestamp": "2026-04-29 12:03:41"}
{"iteration": 31, "score": 0.2857, "best": 0.7143, "eval_type": "SAMPLE", "status": "REVERTED", "categories": {"product": 0.3333, "shop": 0.5, "voucher": 0.0}, "changes": "Fixed the unused `n_products` parameter in `_derive_voucher_price_ceiling`: for multi-product voucher tasks, the code now divides the gross budget by n_products so each product's price ceiling is `gro", "timestamp": "2026-04-29 12:11:55"}
{"iteration": 32, "score": 0.2857, "best": 0.7143, "eval_type": "SAMPLE", "status": "REVERTED", "categories": {"product": 0.3333, "shop": 0.5, "voucher": 0.0}, "changes": "Added a consecutive bigram bonus (+3 per adjacent query-word pair found consecutively in the product title) to `_score_product_relevance`, so queries with specific model names like \"Galaxy S21\" or \"Ul", "timestamp": "2026-04-29 12:18:38"}
{"iteration": 33, "score": 0.5714, "best": 0.7143, "eval_type": "SAMPLE", "status": "REVERTED", "categories": {"product": 0.6667, "shop": 1.0, "voucher": 0.0}, "changes": "When the initial 3-page product search returns fewer than 10 candidates (sparse results), the agent now does one additional search using only the first 3 words of the LLM-extracted keywords — a broa", "timestamp": "2026-04-29 12:25:28"}
{"iteration": 34, "score": 0.5714, "best": 0.7143, "eval_type": "SAMPLE", "status": "REVERTED", "categories": {"product": 0.6667, "shop": 1.0, "voucher": 0.0}, "changes": "In `_score_shop_coverage`, swapped priority from `original_query` to per-spec keywords so shop ranking evaluates each spec's candidates against that spec's focused product query rather than the global", "timestamp": "2026-04-29 12:35:12"}
{"iteration": 35, "score": 0.3, "best": 0.7143, "eval_type": "FULL", "status": "REVERTED", "categories": {"product": 0.5, "shop": 0.4, "voucher": 0.0}, "changes": "For single-product voucher tasks, switched from per-product keyword scoring to full-query scoring — budget/voucher words are already in stopwords so they don't pollute relevance ranking, while the f", "timestamp": "2026-04-29 12:56:50"}
{"iteration": 36, "score": 0.5714, "best": 0.7143, "eval_type": "SAMPLE", "status": "REVERTED", "categories": {"product": 0.6667, "shop": 1.0, "voucher": 0.0}, "changes": "For single-product voucher tasks, route through `_handle_single_product` (full-query scoring, 3-page search, no prefer_cheaper bias) with the voucher price ceiling pre-applied — aligning voucher beh", "timestamp": "2026-04-29 13:05:44"}
{"iteration": 37, "score": 0.5714, "best": 0.7143, "eval_type": "SAMPLE", "status": "REVERTED", "categories": {"product": 0.6667, "shop": 1.0, "voucher": 0.0}, "changes": "Fixed the voucher per-product price ceiling bug: `_derive_voucher_price_ceiling` now divides `gross_budget` by `n_products` (the parameter was accepted but unused), and `_enrich_voucher_product_params", "timestamp": "2026-04-29 13:11:58"}
{"iteration": 38, "score": 0.2857, "best": 0.7143, "eval_type": "SAMPLE", "status": "REVERTED", "categories": {"product": 0.3333, "shop": 0.5, "voucher": 0.0}, "changes": "Added page 4 search for product tasks — extends the candidate pool from ~30 to ~40 products, increasing the chance of finding the correct product when it ranks beyond the first 3 pages of Lucene res", "timestamp": "2026-04-29 13:22:37"}
{"iteration": 39, "score": 0.5714, "best": 0.7143, "eval_type": "SAMPLE", "status": "REVERTED", "categories": {"product": 0.6667, "shop": 0.5, "voucher": 0.5}, "changes": "Changed `use_keyword_query_for_multi=True` → `False` in both voucher search calls: voucher tasks now score candidates against the **full query** (like product tasks do) instead of just the narrow LL", "timestamp": "2026-04-29 13:32:20"}
{"iteration": 40, "score": 0.3667, "best": 0.7143, "eval_type": "FULL", "status": "REVERTED", "categories": {"product": 0.5, "shop": 0.4, "voucher": 0.2}, "changes": "Changed `use_keyword_query_for_multi=True` → `False` in both voucher search calls so voucher candidates are scored against the full query instead of narrow LLM-extracted keywords — voucher/budget ", "timestamp": "2026-04-29 13:50:30"}
{"iteration": 41, "score": 0.5714, "best": 0.7143, "eval_type": "SAMPLE", "status": "REVERTED", "categories": {"product": 0.6667, "shop": 1.0, "voucher": 0.0}, "changes": "For single-product voucher tasks, score candidates against the full query (instead of narrow LLM keywords) to better match all attribute constraints required for rule_score >= 1.0, while preserving ke", "timestamp": "2026-04-29 13:58:17"}
{"iteration": 42, "score": 0.1429, "best": 0.7143, "eval_type": "SAMPLE", "status": "REVERTED", "categories": {"product": 0.3333, "shop": 0.0, "voucher": 0.0}, "changes": "Added a bigram contiguity bonus to `_score_product_relevance`: when two consecutive query keywords appear adjacent in a product title (e.g. \"air max\" or \"max 270\"), the product earns +3 per matching p", "timestamp": "2026-04-29 14:09:34"}
{"iteration": 43, "score": 0.4286, "best": 0.7143, "eval_type": "SAMPLE", "status": "REVERTED", "categories": {"product": 0.3333, "shop": 0.5, "voucher": 0.5}, "changes": "Changed the extraction prompt to always include explicitly required attributes (color, size, capacity, variant) in search keywords — previously \"only if essential to product identity\" caused the LLM", "timestamp": "2026-04-29 14:17:49"}
{"iteration": 44, "score": 0.5714, "best": 0.7143, "eval_type": "SAMPLE", "status": "REVERTED", "categories": {"product": 0.3333, "shop": 1.0, "voucher": 0.5}, "changes": "Increased `MAX_SHOPS_WIDE_QUERY` from 6→10 and `MAX_SHOPS_FOR_TWO_OR_FEWER_SPECS` from 8→15 so the same-shop search checks more candidate shops before giving up, improving coverage when the correc", "timestamp": "2026-04-29 14:25:12"}
{"iteration": 45, "score": 0.2333, "best": 0.7143, "eval_type": "FULL", "status": "REVERTED", "categories": {"product": 0.4, "shop": 0.2, "voucher": 0.1}, "changes": "Added page 4 to the single-product search so the candidate pool grows from 30 to up to 40 products before relevance scoring, giving `_select_best_product` a better chance of finding the correct produc", "timestamp": "2026-04-29 14:43:58"}
{"iteration": 46, "score": 0.4286, "best": 0.7143, "eval_type": "SAMPLE", "status": "REVERTED", "categories": {"product": 0.3333, "shop": 1.0, "voucher": 0.0}, "changes": "Fixed the unused `n_products` parameter bug in `_derive_voucher_price_ceiling`: for multi-product voucher tasks, the code-derived price ceiling now divides the gross budget by the number of products, ", "timestamp": "2026-04-29 14:48:11"}
{"iteration": 47, "score": 0.1429, "best": 0.7143, "eval_type": "SAMPLE", "status": "REVERTED", "categories": {"product": 0.3333, "shop": 0.0, "voucher": 0.0}, "changes": "Reduced `CHEAPER_PRICE_TIEBREAK_DIVISOR` from 100,000 to 10,000 so that `prefer_cheaper=True` (used by voucher and shop tasks) meaningfully penalizes expensive products during relevance tie-breaking, ", "timestamp": "2026-04-29 15:04:03"}
