{"iteration": 0, "score": 0.4286, "best": 0.4286, "eval_type": "BASELINE", "status": "BASELINE", "timestamp": "2026-04-26 07:02:36"}
{"iteration": 1, "score": 0.1429, "best": 0.4286, "eval_type": "SAMPLE", "status": "REVERTED", "categories": {"product": 0.3333, "shop": 0.0, "voucher": 0.0}, "changes": "Added `check_product_match` verification on the top-3 relevance-scored candidates in `_handle_single_product` — uses the first candidate that passes the attribute check, falling back to the top rele", "timestamp": "2026-04-26 07:10:24"}
{"iteration": 2, "score": 0.2857, "best": 0.4286, "eval_type": "SAMPLE", "status": "REVERTED", "categories": {"product": 0.3333, "shop": 0.0, "voucher": 0.5}, "changes": "Added page 2 fetching in `_collect_broad_shop_results` to double the candidate shop pool per spec, increasing the likelihood of discovering a shop that sells all required items for shop tasks (which w", "timestamp": "2026-04-26 07:14:55"}
{"iteration": 3, "score": 0.1429, "best": 0.4286, "eval_type": "SAMPLE", "status": "REVERTED", "categories": {"product": 0.3333, "shop": 0.0, "voucher": 0.0}, "changes": "Removed price filter from the broad shop-discovery phase so more candidate shops appear in the initial sweep — price constraints are already enforced later when selecting products within each candid", "timestamp": "2026-04-26 07:18:38"}
{"iteration": 4, "score": 0.1429, "best": 0.4286, "eval_type": "SAMPLE", "status": "REVERTED", "categories": {"product": 0.3333, "shop": 0.0, "voucher": 0.0}, "changes": "Added a retry in `_handle_same_shop_search`: when the first `find_products_in_same_shop` call fails, retry with simplified 2-word queries per spec — broader terms increase the chance the correct sho", "timestamp": "2026-04-26 07:25:15"}
{"iteration": 5, "score": 0.2667, "best": 0.4286, "eval_type": "FULL", "status": "REVERTED", "categories": {"product": 0.5, "shop": 0.2, "voucher": 0.1}, "changes": "Added a 4th fallback in `_pick_products_for_shop`: when all existing shop-specific searches return empty, retry with the first 2 words of the keyword query inside the same shop — this handles the ca", "timestamp": "2026-04-26 07:41:24"}
{"iteration": 6, "score": 0.4286, "best": 0.4286, "eval_type": "SAMPLE", "status": "REVERTED", "categories": {"product": 0.6667, "shop": 0.5, "voucher": 0.0}, "changes": "For single-product voucher tasks, score relevance against the full query (not just extracted keywords), so attribute details like size, color, and model that appear in the query but weren't captured i", "timestamp": "2026-04-26 07:46:11"}
{"iteration": 7, "score": 0.2857, "best": 0.4286, "eval_type": "SAMPLE", "status": "REVERTED", "categories": {"product": 0.3333, "shop": 0.0, "voucher": 0.5}, "changes": "Changed `_enrich_voucher_product_params` to always compare the LLM-extracted price ceiling against the code-derived pre-discount ceiling and use the larger (looser) value — previously, if the LLM se", "timestamp": "2026-04-26 07:51:16"}
{"iteration": 8, "score": 0.1429, "best": 0.4286, "eval_type": "SAMPLE", "status": "REVERTED", "categories": {"product": 0.3333, "shop": 0.0, "voucher": 0.0}, "changes": "For single-product voucher tasks, changed relevance scoring from keyword-only to full-query scoring (mirroring the product task path), so product attributes like color, size, and model number that app", "timestamp": "2026-04-26 07:59:16"}
{"iteration": 9, "score": 0.2857, "best": 0.4286, "eval_type": "SAMPLE", "status": "REVERTED", "categories": {"product": 0.3333, "shop": 0.5, "voucher": 0.0}, "changes": "In `_collect_broad_shop_results`, also fetch page 2 for each spec to double the candidate shop pool — the correct shop may not appear on page 1 for every product spec, so this expands coverage for s", "timestamp": "2026-04-26 08:03:56"}
{"iteration": 10, "score": 0.2, "best": 0.4286, "eval_type": "FULL", "status": "REVERTED", "categories": {"product": 0.4, "shop": 0.2, "voucher": 0.0}, "changes": "Changed `_score_shop_coverage` to use each spec's own per-product keyword query for relevance scoring (falling back to the full original query only if empty), so shops are ranked by how well they matc", "timestamp": "2026-04-26 08:20:23"}
{"iteration": 11, "score": 0.4286, "best": 0.4286, "eval_type": "SAMPLE", "status": "REVERTED", "categories": {"product": 0.3333, "shop": 0.5, "voucher": 0.5}, "changes": "Changed `_enrich_voucher_product_params` to always use the code-derived gross-budget ceiling (budget / (1 - discount%)) when it can be parsed from the query, instead of skipping when the LLM already s", "timestamp": "2026-04-26 08:29:17"}
{"iteration": 12, "score": 0.2857, "best": 0.4286, "eval_type": "SAMPLE", "status": "REVERTED", "categories": {"product": 0.3333, "shop": 0.5, "voucher": 0.0}, "changes": "Added page 3 fetching for product tasks: expands the candidate pool from 20 to 30 results, improving the chance that the correct specific product variant (right color, size, storage) is included befor", "timestamp": "2026-04-26 08:38:02"}
{"iteration": 13, "score": 0.2857, "best": 0.4286, "eval_type": "SAMPLE", "status": "REVERTED", "categories": {"product": 0.6667, "shop": 0.0, "voucher": 0.0}, "changes": "Removed the early-return guard in `_enrich_voucher_product_params` so the code-derived gross-budget ceiling always overrides the LLM's price_range for voucher tasks — the LLM tends to compute the po", "timestamp": "2026-04-26 08:42:01"}
{"iteration": 14, "score": 0.1429, "best": 0.4286, "eval_type": "SAMPLE", "status": "REVERTED", "categories": {"product": 0.3333, "shop": 0.0, "voucher": 0.0}, "changes": "Changed `_enrich_voucher_product_params` to always compute the code-derived gross-budget ceiling and use whichever is larger between that and the LLM's value, so when the LLM incorrectly uses the post", "timestamp": "2026-04-26 08:45:44"}
{"iteration": 15, "score": 0.2333, "best": 0.4286, "eval_type": "FULL", "status": "REVERTED", "categories": {"product": 0.4, "shop": 0.3, "voucher": 0.0}, "changes": "Used LLM-extracted keywords (instead of the full raw query) for relevance scoring in `_handle_single_product`, matching the pattern already used in `_search_products_individually` — the full query i", "timestamp": "2026-04-26 09:00:08"}
{"iteration": 16, "score": 0.2857, "best": 0.4286, "eval_type": "SAMPLE", "status": "REVERTED", "categories": {"product": 0.6667, "shop": 0.0, "voucher": 0.0}, "changes": "In `_score_shop_coverage` and `_pick_products_for_shop`, changed scoring to use per-spec keywords instead of the full original query, so each product in a multi-spec shop task is evaluated against its", "timestamp": "2026-04-26 09:05:14"}
{"iteration": 17, "score": 0.2857, "best": 0.4286, "eval_type": "SAMPLE", "status": "REVERTED", "categories": {"product": 0.3333, "shop": 0.5, "voucher": 0.0}, "changes": "Updated the LLM extraction prompt for voucher tasks: instead of always using `\"0-{ceil}\"` (which ignores explicit lower price bounds), the LLM now preserves any explicit lower bound from the query and", "timestamp": "2026-04-26 09:10:48"}
{"iteration": 18, "score": 0.2857, "best": 0.4286, "eval_type": "SAMPLE", "status": "REVERTED", "categories": {"product": 0.3333, "shop": 0.0, "voucher": 0.5}, "changes": "Added `sort=\"price_asc\"` to both voucher search calls in `_handle_voucher_search` so the API returns cheaper products first, increasing the chance that the relevance-scored candidates are all within b", "timestamp": "2026-04-26 09:15:44"}
{"iteration": 19, "score": 0.4286, "best": 0.4286, "eval_type": "SAMPLE", "status": "REVERTED", "categories": {"product": 0.6667, "shop": 0.0, "voucher": 0.5}, "changes": "Always enforce the code-derived budget ceiling as an upper bound on LLM-extracted price ranges in voucher tasks — fixing cases where the LLM over-estimates the per-product price limit, causing recom", "timestamp": "2026-04-26 09:31:18"}
{"iteration": 20, "score": 0.3333, "best": 0.4286, "eval_type": "FULL", "status": "REVERTED", "categories": {"product": 0.5, "shop": 0.4, "voucher": 0.1}, "changes": "Added page 2 fetching to `_collect_broad_shop_results` so the broad shop-discovery phase examines 20 products per spec instead of 10, doubling the chance of finding a shop that carries all required it", "timestamp": "2026-04-26 09:45:38"}
{"iteration": 21, "score": 0.2857, "best": 0.4286, "eval_type": "SAMPLE", "status": "REVERTED", "categories": {"product": 0.6667, "shop": 0.0, "voucher": 0.0}, "changes": "Always cap LLM-extracted voucher price ranges with the code-derived budget ceiling to prevent over-budget recommendations when the LLM over-estimates the per-product price limit.", "timestamp": "2026-04-26 09:59:26"}
{"iteration": 22, "score": 0.4286, "best": 0.4286, "eval_type": "SAMPLE", "status": "REVERTED", "categories": {"product": 0.3333, "shop": 0.5, "voucher": 0.5}, "changes": "Added page 2 fetching to the broad shop discovery phase only for pure shop tasks (not same-shop voucher tasks), so the shop score improvement seen in iteration 20 (0.4 on full eval) is preserved while", "timestamp": "2026-04-26 10:06:22"}
{"iteration": 23, "score": 0.1429, "best": 0.4286, "eval_type": "SAMPLE", "status": "REVERTED", "categories": {"product": 0.3333, "shop": 0.0, "voucher": 0.0}, "changes": "Added page 2 fetching to the broad shop discovery phase (`_collect_broad_shop_results`) exclusively for pure shop tasks by passing `_n_broad_pages: 2` in the metadata when `is_voucher=False`, doubling", "timestamp": "2026-04-26 10:14:56"}
{"iteration": 24, "score": 0.2857, "best": 0.4286, "eval_type": "SAMPLE", "status": "REVERTED", "categories": {"product": 0.3333, "shop": 0.5, "voucher": 0.0}, "changes": "Removed price filtering from the broad shop discovery phase (`_collect_broad_shop_results`) — price constraints were unnecessarily narrowing the product pool used to identify candidate shops, so the", "timestamp": "2026-04-26 10:21:22"}
{"iteration": 25, "score": 0.3, "best": 0.4286, "eval_type": "FULL", "status": "REVERTED", "categories": {"product": 0.5, "shop": 0.2, "voucher": 0.2}, "changes": "Added service post-filtering (with graceful no-op fallback when empty) to both `_handle_single_product` and `_search_products_individually` — this mirrors the existing post-filtering already done in", "timestamp": "2026-04-26 10:41:36"}
{"iteration": 26, "score": 0.1429, "best": 0.4286, "eval_type": "SAMPLE", "status": "REVERTED", "categories": {"product": 0.3333, "shop": 0.0, "voucher": 0.0}, "changes": "Added page 2 fetching to `_collect_broad_shop_results` (defaulting to `n_pages=2`), doubling the broad shop candidate pool for same-shop discovery — mirroring the change from iteration 22 that achie", "timestamp": "2026-04-26 10:45:12"}
{"iteration": 27, "score": 0.4286, "best": 0.4286, "eval_type": "SAMPLE", "status": "REVERTED", "categories": {"product": 0.3333, "shop": 0.5, "voucher": 0.5}, "changes": "Added service post-filtering (with safe fallback to unfiltered pool) exclusively in `_handle_single_product` — this mirrors the fix from iteration 25 that raised product scores to 0.5, but scoped on", "timestamp": "2026-04-26 10:50:41"}
{"iteration": 28, "score": 0.2857, "best": 0.4286, "eval_type": "SAMPLE", "status": "REVERTED", "categories": {"product": 0.6667, "shop": 0.0, "voucher": 0.0}, "changes": "Added service post-filtering with safe fallback to `_handle_single_product` — when the product spec requires a service tag (e.g. COD, official), only products matching those tags are passed to relev", "timestamp": "2026-04-26 10:54:23"}
{"iteration": 29, "score": 0.4286, "best": 0.4286, "eval_type": "SAMPLE", "status": "REVERTED", "categories": {"product": 0.6667, "shop": 0.0, "voucher": 0.5}, "changes": "Added page 3 fetching to `_handle_single_product`, increasing the candidate pool from 20 to 30 results for the product task — giving the relevance ranker more options to find the semantically correc", "timestamp": "2026-04-26 11:01:51"}
{"iteration": 30, "score": 0.3, "best": 0.4286, "eval_type": "FULL", "status": "REVERTED", "categories": {"product": 0.5, "shop": 0.2, "voucher": 0.2}, "changes": "Removed the per-product budget division in `_derive_voucher_price_ceiling` — the ceiling now equals the full pre-discount budget (not divided by n_products), so multi-product voucher searches no lon", "timestamp": "2026-04-26 11:20:15"}
{"iteration": 31, "score": 0.4286, "best": 0.4286, "eval_type": "SAMPLE", "status": "REVERTED", "categories": {"product": 0.6667, "shop": 0.0, "voucher": 0.5}, "changes": "Changed the second broad-shop discovery phase to also drop price filters (alongside the existing service-filter removal), widening the candidate shop pool so the right shop is more likely to be discov", "timestamp": "2026-04-26 11:25:48"}
{"iteration": 32, "score": 0.5714, "best": 0.5714, "eval_type": "SAMPLE", "status": "KEPT", "categories": {"product": 0.6667, "shop": 0.5, "voucher": 0.5}, "changes": "Changed `_collect_broad_shop_results` to fetch pages 1 and 2 per spec (20 candidates instead of 10), doubling the shop discovery pool so shops whose products rank 11–20 in search results are no long", "timestamp": "2026-04-26 11:30:25"}
{"iteration": 33, "score": 0.4286, "best": 0.5714, "eval_type": "SAMPLE", "status": "REVERTED", "categories": {"product": 0.3333, "shop": 0.5, "voucher": 0.5}, "changes": "Changed `_collect_broad_shop_results` to fetch pages 1, 2, and 3 per spec (30 candidates instead of 20), further widening the shop discovery pool so shops whose products rank 21–30 in search results", "timestamp": "2026-04-26 11:34:57"}
{"iteration": 34, "score": 0.5714, "best": 0.5714, "eval_type": "SAMPLE", "status": "REVERTED", "categories": {"product": 0.6667, "shop": 0.5, "voucher": 0.5}, "changes": "In `_score_shop_coverage`, changed shop ranking to use per-spec keyword queries (e.g. \"mountain bicycle\") instead of the full combined original query, so each spec's products are scored against their ", "timestamp": "2026-04-26 11:40:27"}
{"iteration": 35, "score": 0.2667, "best": 0.5714, "eval_type": "FULL", "status": "REVERTED", "categories": {"product": 0.4, "shop": 0.3, "voucher": 0.1}, "changes": "Changed `_handle_single_product` to score product relevance against the LLM-extracted `keywords` (e.g. \"iphone 15 pro max case\") instead of the full user query, which contains price ranges, service na", "timestamp": "2026-04-26 11:58:22"}
{"iteration": 36, "score": 0.4286, "best": 0.5714, "eval_type": "SAMPLE", "status": "REVERTED", "categories": {"product": 0.3333, "shop": 0.5, "voucher": 0.5}, "changes": "Added page 3 fetching to `_handle_single_product` so the relevance selection pool grows from up to 20 candidates (pages 1+2) to up to 30 (pages 1+2+3), increasing the chance of finding the right produ", "timestamp": "2026-04-26 12:07:53"}
{"iteration": 37, "score": 0.5714, "best": 0.5714, "eval_type": "SAMPLE", "status": "REVERTED", "categories": {"product": 0.6667, "shop": 0.5, "voucher": 0.5}, "changes": "Fixed the per-product price ceiling for multi-product voucher tasks: removed the division by `n_products` in both the LLM prompt and the `_derive_voucher_price_ceiling` fallback. Equal-division was in", "timestamp": "2026-04-26 12:25:52"}
{"iteration": 38, "score": 0.4286, "best": 0.5714, "eval_type": "SAMPLE", "status": "REVERTED", "categories": {"product": 0.3333, "shop": 0.5, "voucher": 0.5}, "changes": "For single-product voucher tasks, use the full original query for relevance scoring (instead of LLM-extracted keywords) so color, size, and model attributes mentioned in the query contribute to produc", "timestamp": "2026-04-26 12:33:07"}
{"iteration": 39, "score": 0.2857, "best": 0.5714, "eval_type": "SAMPLE", "status": "REVERTED", "categories": {"product": 0.3333, "shop": 0.5, "voucher": 0.0}, "changes": "Filtered pure numeric words (e.g. \"200\", \"500\" from price ranges) out of relevance scoring in `_extract_query_words`, preventing price numbers in queries from artificially boosting products that happe", "timestamp": "2026-04-26 12:39:44"}
{"iteration": 40, "score": 0.4333, "best": 0.5714, "eval_type": "FULL", "status": "REVERTED", "categories": {"product": 0.7, "shop": 0.4, "voucher": 0.2}, "changes": "Added page 3 to `_collect_broad_shop_results`, expanding the shop discovery pool from ~20 to ~30 products per spec (these are direct API calls, not dialogue steps), increasing the chance of finding a ", "timestamp": "2026-04-26 13:04:37"}
{"iteration": 41, "score": 0.5714, "best": 0.5714, "eval_type": "SAMPLE", "status": "REVERTED", "categories": {"product": 0.6667, "shop": 0.5, "voucher": 0.5}, "changes": "Switched shop scoring in `_score_shop_coverage` and `_pick_products_for_shop` to use per-spec keywords as the primary scoring query (falling back to original_query), so each product is evaluated again", "timestamp": "2026-04-26 13:13:51"}
{"iteration": 42, "score": 0.4286, "best": 0.5714, "eval_type": "SAMPLE", "status": "REVERTED", "categories": {"product": 0.6667, "shop": 0.5, "voucher": 0.0}, "changes": "Increased `MAX_SHOPS_WIDE_QUERY` from 6→10 and `MAX_SHOPS_FOR_TWO_OR_FEWER_SPECS` from 8→12, so the agent evaluates more candidate shops before giving up on same-shop tasks, improving the chance o", "timestamp": "2026-04-26 13:26:32"}
{"iteration": 43, "score": 0.2857, "best": 0.5714, "eval_type": "SAMPLE", "status": "REVERTED", "categories": {"product": 0.6667, "shop": 0.0, "voucher": 0.0}, "changes": "Increased `extra_pages` from 1→2 in `_handle_voucher_search`, expanding the voucher candidate pool from 20 to 30 products (3 pages × 10) per item, giving the relevance scorer more candidates to fin", "timestamp": "2026-04-26 13:41:05"}
{"iteration": 44, "score": 0.2857, "best": 0.5714, "eval_type": "SAMPLE", "status": "REVERTED", "categories": {"product": 0.0, "shop": 0.5, "voucher": 0.5}, "changes": "Changed `_handle_single_product` to score candidates against LLM-extracted keywords (`product.get(\"keywords\")`) instead of the full query, reducing noise from price numbers and service words — consi", "timestamp": "2026-04-26 13:49:17"}
{"iteration": 45, "score": 0.3333, "best": 0.5714, "eval_type": "FULL", "status": "REVERTED", "categories": {"product": 0.5, "shop": 0.4, "voucher": 0.1}, "changes": "For single-product voucher tasks, switched scoring from extracted keywords to the full query (same as product tasks that score 0.7), since the LLM's 2-5-word keyword extraction can drop relevant attri", "timestamp": "2026-04-26 14:09:50"}
{"iteration": 46, "score": 0.5714, "best": 0.5714, "eval_type": "SAMPLE", "status": "REVERTED", "categories": {"product": 0.6667, "shop": 0.5, "voucher": 0.5}, "changes": "Changed shop task scoring to use per-spec LLM-extracted keywords (via `spec.get(\"keywords\")`) instead of the full multi-product `original_query`, so each product spec is evaluated against only its own", "timestamp": "2026-04-26 14:20:44"}
{"iteration": 47, "score": 0.5714, "best": 0.5714, "eval_type": "SAMPLE", "status": "REVERTED", "categories": {"product": 0.6667, "shop": 0.5, "voucher": 0.5}, "changes": "Changed `_score_shop_coverage` to use per-spec keywords (`specs[index].get(\"q\")`) over the full multi-item `original_query` when ranking candidate shops, so each product spec is evaluated against only", "timestamp": "2026-04-26 14:26:04"}
{"iteration": 48, "score": 0.5714, "best": 0.5714, "eval_type": "SAMPLE", "status": "REVERTED", "categories": {"product": 0.6667, "shop": 1.0, "voucher": 0.0}, "changes": "Added page 3 to `_collect_broad_shop_results`, expanding the shop candidate discovery pool from 20 to 30 products per spec so shops whose items appear on page 3 of broad searches are no longer missed.", "timestamp": "2026-04-26 14:32:34"}
{"iteration": 49, "score": 0.7143, "best": 0.7143, "eval_type": "SAMPLE", "status": "KEPT", "categories": {"product": 0.6667, "shop": 1.0, "voucher": 0.5}, "changes": "Added page 3 to `_collect_broad_shop_results`, expanding the shop candidate pool from 20 to 30 products per spec — iteration 48 showed this change boosted shop score from 0.5 to 1.0 on sample, and t", "timestamp": "2026-04-26 14:44:06"}
{"iteration": 50, "score": 0.3667, "best": 0.7143, "eval_type": "FULL", "status": "REVERTED", "categories": {"product": 0.5, "shop": 0.4, "voucher": 0.2}, "changes": "Added page 3 to voucher individual product searches (`extra_pages=1` → `extra_pages=2`), mirroring the page-3 expansion that boosted shop score from 0.5→1.0 in iteration 49, giving the `prefer_che", "timestamp": "2026-04-26 15:04:44"}
