{"iteration": 54, "score": 0.2857, "best": 0.5714, "eval_type": "SAMPLE", "status": "REVERTED", "categories": {"product": 0.3333, "shop": 0.0, "voucher": 0.5}, "changes": "Added a page 2 search to `_handle_single_product` so the candidate pool doubles from 10 to up to 20 products, matching the same coverage strategy already used for voucher tasks (`extra_pages=1`), whic", "timestamp": "2026-04-23 14:38:09"}
{"iteration": 55, "score": 0.2, "best": 0.5714, "eval_type": "FULL", "status": "REVERTED", "categories": {"product": 0.5, "shop": 0.1, "voucher": 0.0}, "changes": "Changed `_derive_voucher_price_ceiling` to use the full gross budget as the per-product price ceiling instead of `gross_budget / n_products` â€” the division was overly restrictive for multi-product v", "timestamp": "2026-04-23 14:53:49"}
{"iteration": 56, "score": 0.2857, "best": 0.5714, "eval_type": "SAMPLE", "status": "REVERTED", "categories": {"product": 0.6667, "shop": 0.0, "voucher": 0.0}, "changes": "Removed the `_enrich_voucher_product_params` enrichment step from `_handle_voucher_search` â€” the budget-derived per-product price ceiling (`gross_budget / n_products`) was too restrictive and filter", "timestamp": "2026-04-23 15:02:31"}
{"iteration": 57, "score": 0.2857, "best": 0.5714, "eval_type": "SAMPLE", "status": "REVERTED", "categories": {"product": 0.3333, "shop": 0.5, "voucher": 0.0}, "changes": "Changed `_collect_broad_shop_results` to fetch page 2 in addition to page 1 for each spec, doubling the candidate-shop pool (from 10 to up to 20 products per spec) so the correct shop is more likely t", "timestamp": "2026-04-23 15:10:03"}
