{"iteration": 0, "score": 0.2857, "best": 0.2857, "eval_type": "BASELINE", "status": "BASELINE", "timestamp": "2026-04-23 07:03:05"}
{"iteration": 1, "score": 0.2857, "best": 0.2857, "eval_type": "SAMPLE", "status": "REVERTED", "categories": {"product": 0.6667, "shop": 0.0, "voucher": 0.0}, "changes": "Added progressive filter relaxation to `_handle_single_product`: when fewer than 3 results are returned (indicating over-filtering), it retries without the price filter, then without the service filte", "timestamp": "2026-04-23 07:06:21"}
{"iteration": 2, "score": 0.1429, "best": 0.2857, "eval_type": "SAMPLE", "status": "REVERTED", "categories": {"product": 0.3333, "shop": 0.0, "voucher": 0.0}, "changes": "Changed `_collect_broad_shop_results` to fetch pages 1 and 2 per product spec, doubling the candidate shop pool for same-shop discovery â€” shop score was 0.0 because candidate shops visible on page 1", "timestamp": "2026-04-23 07:09:58"}
{"iteration": 3, "score": 0.2857, "best": 0.2857, "eval_type": "SAMPLE", "status": "REVERTED", "categories": {"product": 0.3333, "shop": 0.0, "voucher": 0.5}, "changes": "Added a short-keyword fallback in `_pick_products_for_shop`: when all shop-specific searches with full keywords return empty results, retry using only the first 3 keywords â€” broadening the within-sh", "timestamp": "2026-04-23 07:17:54"}
{"iteration": 4, "score": 0.1429, "best": 0.2857, "eval_type": "SAMPLE", "status": "REVERTED", "categories": {"product": 0.3333, "shop": 0.0, "voucher": 0.0}, "changes": "Added page 2 to `_collect_broad_shop_results` so the candidate shop pool doubles (up to 20 products per spec instead of 10), increasing the chance that the correct shop is discovered before being trie", "timestamp": "2026-04-23 07:24:58"}
{"iteration": 5, "score": 0.2667, "best": 0.2857, "eval_type": "FULL", "status": "REVERTED", "categories": {"product": 0.5, "shop": 0.2, "voucher": 0.1}, "changes": "Changed `_collect_broad_shop_results` to pass `include_price=False` during the broad shop discovery phase â€” price filters were narrowing the candidate pool and preventing the correct shop from being", "timestamp": "2026-04-23 07:38:15"}
{"iteration": 6, "score": 0.1429, "best": 0.2857, "eval_type": "SAMPLE", "status": "REVERTED", "categories": {"product": 0.3333, "shop": 0.0, "voucher": 0.0}, "changes": "Added page 2 retrieval to `_handle_single_product`, doubling the candidate pool from 10 to up to 20 products before relevance ranking â€” matching the strategy already used for voucher tasks and impro", "timestamp": "2026-04-23 07:47:38"}
{"iteration": 7, "score": 0.4286, "best": 0.4286, "eval_type": "SAMPLE", "status": "KEPT", "categories": {"product": 0.6667, "shop": 0.0, "voucher": 0.5}, "changes": "Added a fallback search in `_handle_single_product` that retries with keywords-only (no price/service filters) when the initial search returns empty results â€” this rescues cases where the LLM extrac", "timestamp": "2026-04-23 07:52:47"}
{"iteration": 8, "score": 0.2857, "best": 0.4286, "eval_type": "SAMPLE", "status": "REVERTED", "categories": {"product": 0.3333, "shop": 0.0, "voucher": 0.5}, "changes": "Added a third fallback phase to `find_products_in_same_shop` that drops price filters from the broad shop-discovery search (while targeted per-shop searches still enforce price), so shops whose produc", "timestamp": "2026-04-23 08:02:18"}
{"iteration": 9, "score": 0.2857, "best": 0.4286, "eval_type": "SAMPLE", "status": "REVERTED", "categories": {"product": 0.3333, "shop": 0.5, "voucher": 0.0}, "changes": "Added a price-stripped retry in `_handle_same_shop_search`: when the initial `find_products_in_same_shop` call fails and the queries had price filters, retry without price to broaden shop discovery â€", "timestamp": "2026-04-23 08:08:29"}
{"iteration": 10, "score": 0.3333, "best": 0.4286, "eval_type": "FULL", "status": "REVERTED", "categories": {"product": 0.5, "shop": 0.3, "voucher": 0.2}, "changes": "Added page 2 fetching to `_collect_broad_shop_results` so broad shop discovery considers up to 20 products per spec (instead of 10), doubling the candidate shop pool and making it far more likely the ", "timestamp": "2026-04-23 08:25:44"}
{"iteration": 11, "score": 0.4286, "best": 0.4286, "eval_type": "SAMPLE", "status": "REVERTED", "categories": {"product": 0.6667, "shop": 0.5, "voucher": 0.0}, "changes": "Increased `MAX_SHOPS_WIDE_QUERY` from 6â†’10 and `MAX_SHOPS_FOR_TWO_OR_FEWER_SPECS` from 8â†’14 so the same-shop search tries more candidate shops before giving up â€” targeting the consistently 0.0 s", "timestamp": "2026-04-23 08:31:22"}
{"iteration": 12, "score": 0.2857, "best": 0.4286, "eval_type": "SAMPLE", "status": "REVERTED", "categories": {"product": 0.3333, "shop": 0.5, "voucher": 0.0}, "changes": "Added page 2 fetch to `_handle_single_product` so the candidate pool doubles from 10 to up to 20 products before relevance selection, increasing the chance of finding the correct product when it falls", "timestamp": "2026-04-23 08:37:51"}
{"iteration": 13, "score": 0.4286, "best": 0.4286, "eval_type": "SAMPLE", "status": "REVERTED", "categories": {"product": 0.6667, "shop": 0.5, "voucher": 0.0}, "changes": "Increased `MAX_SHOPS_WIDE_QUERY` from 6â†’10 and `MAX_SHOPS_FOR_TWO_OR_FEWER_SPECS` from 8â†’14 so the same-shop search evaluates more candidate shops before giving up, directly targeting the shop tas", "timestamp": "2026-04-23 08:46:26"}
{"iteration": 14, "score": 0.5714, "best": 0.5714, "eval_type": "SAMPLE", "status": "KEPT", "categories": {"product": 0.6667, "shop": 0.5, "voucher": 0.5}, "changes": "Added `_derive_voucher_price_ceiling` and `_enrich_voucher_product_params` helpers that extract the total budget from voucher queries, adjust upward by the discount amount/percentage to get the pre-di", "timestamp": "2026-04-23 08:52:25"}
{"iteration": 15, "score": 0.2667, "best": 0.5714, "eval_type": "FULL", "status": "REVERTED", "categories": {"product": 0.6, "shop": 0.2, "voucher": 0.0}, "changes": "Widened `_enrich_voucher_product_params` to always derive the gross (pre-discount) price ceiling and expand any LLM-extracted range that is narrower, so products priced between the stated budget and t", "timestamp": "2026-04-23 09:10:57"}
{"iteration": 16, "score": 0.2857, "best": 0.5714, "eval_type": "SAMPLE", "status": "REVERTED", "categories": {"product": 0.3333, "shop": 0.0, "voucher": 0.5}, "changes": "Added page 2 fetching to `_collect_broad_shop_results` so the broad same-shop candidate pool doubles from 10 to up to 20 products per spec, increasing the chance of discovering a shop that carries all", "timestamp": "2026-04-23 09:15:54"}
{"iteration": 17, "score": 0.1429, "best": 0.5714, "eval_type": "SAMPLE", "status": "REVERTED", "categories": {"product": 0.3333, "shop": 0.0, "voucher": 0.0}, "changes": "In Phase 2 of same-shop discovery (`omit_service_from_api=True`), also drop price filters so shops previously hidden by tight price constraints become discoverable â€” price is still enforced during w", "timestamp": "2026-04-23 09:22:44"}
{"iteration": 18, "score": 0.4286, "best": 0.5714, "eval_type": "SAMPLE", "status": "REVERTED", "categories": {"product": 0.3333, "shop": 0.5, "voucher": 0.5}, "changes": "Used LLM-extracted `keywords` instead of the raw full `query` for relevance scoring in `_handle_single_product`, so ranking focuses on product-type/brand/attribute terms rather than price ranges and s", "timestamp": "2026-04-23 09:28:19"}
{"iteration": 19, "score": 0.4286, "best": 0.5714, "eval_type": "SAMPLE", "status": "REVERTED", "categories": {"product": 0.3333, "shop": 0.5, "voucher": 0.5}, "changes": "Added page 2 fetching in `_handle_single_product` to double the candidate pool from 10 to up to 20 products before relevance scoring, increasing the chance of finding the correct product for single-pr", "timestamp": "2026-04-23 09:32:51"}
{"iteration": 20, "score": 0.2667, "best": 0.5714, "eval_type": "FULL", "status": "REVERTED", "categories": {"product": 0.6, "shop": 0.2, "voucher": 0.0}, "changes": "In `_score_shop_coverage`, swapped the priority so each spec's products are scored against that spec's own keyword string (e.g., \"wireless mouse\") rather than the full original query (which mentions a", "timestamp": "2026-04-23 09:50:21"}
{"iteration": 21, "score": 0.5714, "best": 0.5714, "eval_type": "SAMPLE", "status": "REVERTED", "categories": {"product": 0.6667, "shop": 0.5, "voucher": 0.5}, "changes": "Added `not query_word.isdigit()` to the digit-bonus check in `_score_product_relevance`, so pure numeric strings like price range numbers (\"1000\", \"500\") no longer receive an extra +2 relevance bonus ", "timestamp": "2026-04-23 09:59:28"}
{"iteration": 22, "score": 0.1429, "best": 0.5714, "eval_type": "SAMPLE", "status": "REVERTED", "categories": {"product": 0.3333, "shop": 0.0, "voucher": 0.0}, "changes": "Added page 2 fetching in `_collect_broad_shop_results` so the broad shop-discovery phase considers up to 20 products per spec instead of 10, doubling the number of candidate shops visible before ranki", "timestamp": "2026-04-23 10:06:10"}
{"iteration": 23, "score": 0.2857, "best": 0.5714, "eval_type": "SAMPLE", "status": "REVERTED", "categories": {"product": 0.6667, "shop": 0.0, "voucher": 0.0}, "changes": "In `_handle_single_product`, when the fallback search (no price/service filters) runs, now re-apply the service filter to the fallback results so we don't recommend a product missing required service ", "timestamp": "2026-04-23 10:12:07"}
{"iteration": 24, "score": 0.4286, "best": 0.5714, "eval_type": "SAMPLE", "status": "REVERTED", "categories": {"product": 0.3333, "shop": 0.5, "voucher": 0.5}, "changes": "In `_score_product_relevance`, added `not query_word.isdigit()` guard so pure numeric strings like price range numbers (\"1000\", \"2000\") no longer receive a spurious +2 relevance bonus â€” that bonus i", "timestamp": "2026-04-23 10:17:39"}
{"iteration": 25, "score": 0.2667, "best": 0.5714, "eval_type": "FULL", "status": "REVERTED", "categories": {"product": 0.5, "shop": 0.2, "voucher": 0.1}, "changes": "Added page 2 fetching in `_handle_single_product` so the candidate pool for product tasks is up to 20 products (pages 1+2) instead of 10, increasing the chance of finding the correct product when the ", "timestamp": "2026-04-23 10:35:01"}
{"iteration": 26, "score": 0.1429, "best": 0.5714, "eval_type": "SAMPLE", "status": "REVERTED", "categories": {"product": 0.3333, "shop": 0.0, "voucher": 0.0}, "changes": "In `_handle_single_product`, switched relevance scoring from the raw user query to the LLM-extracted product keywords, so price numbers and service terms in the query no longer spuriously boost wrong ", "timestamp": "2026-04-23 10:39:11"}
{"iteration": 27, "score": 0.1429, "best": 0.5714, "eval_type": "SAMPLE", "status": "REVERTED", "categories": {"product": 0.3333, "shop": 0.0, "voucher": 0.0}, "changes": "Filtered 4+ digit pure-numeric tokens (price ranges like \"1000\", \"5000\") from `_extract_query_words` so they no longer spuriously boost products with those digits in their titles, while preserving sho", "timestamp": "2026-04-23 10:44:51"}
{"iteration": 28, "score": 0.1429, "best": 0.5714, "eval_type": "SAMPLE", "status": "REVERTED", "categories": {"product": 0.3333, "shop": 0.0, "voucher": 0.0}, "changes": "In `_collect_broad_shop_results`, now fetches pages 1 and 2 per spec (20 products per spec instead of 10) during shop discovery, doubling the shop candidate pool and increasing the chance of finding a", "timestamp": "2026-04-23 10:50:47"}
{"iteration": 29, "score": 0.2857, "best": 0.5714, "eval_type": "SAMPLE", "status": "REVERTED", "categories": {"product": 0.6667, "shop": 0.0, "voucher": 0.0}, "changes": "Changed `_derive_voucher_price_ceiling` to use `gross_budget` as the per-product price ceiling instead of `gross_budget / n_products`, because equal-split assumptions incorrectly reject valid products", "timestamp": "2026-04-23 10:55:03"}
{"iteration": 30, "score": 0.2667, "best": 0.5714, "eval_type": "FULL", "status": "REVERTED", "categories": {"product": 0.5, "shop": 0.3, "voucher": 0.0}, "changes": "Added a third broad-search phase to `find_products_in_same_shop` that omits both the service filter and the price filter during shop discovery, so candidate shops that happen to return only out-of-ran", "timestamp": "2026-04-23 11:09:39"}
{"iteration": 31, "score": 0.2857, "best": 0.5714, "eval_type": "SAMPLE", "status": "REVERTED", "categories": {"product": 0.3333, "shop": 0.0, "voucher": 0.5}, "changes": "Changed shop discovery phase 2 to omit both the service AND price filters (instead of only service), giving `find_products_in_same_shop` a much broader candidate pool in the fallback phase without add", "timestamp": "2026-04-23 11:20:35"}
{"iteration": 32, "score": 0.2857, "best": 0.5714, "eval_type": "SAMPLE", "status": "REVERTED", "categories": {"product": 0.3333, "shop": 0.5, "voucher": 0.0}, "changes": "Added a page 2 search to `_handle_single_product` so it evaluates up to 20 candidates instead of 10 â€” mirroring the existing `extra_pages=1` pattern in the voucher path â€” increasing the chance of ", "timestamp": "2026-04-23 11:27:56"}
{"iteration": 33, "score": 0.1429, "best": 0.5714, "eval_type": "SAMPLE", "status": "REVERTED", "categories": {"product": 0.3333, "shop": 0.0, "voucher": 0.0}, "changes": "Changed `score_query = original_query or query_text` to `score_query = query_text or original_query` in `_pick_products_for_shop`, so each product spec is scored against its own extracted keywords rat", "timestamp": "2026-04-23 11:34:44"}
{"iteration": 34, "score": 0.1429, "best": 0.5714, "eval_type": "SAMPLE", "status": "REVERTED", "categories": {"product": 0.3333, "shop": 0.0, "voucher": 0.0}, "changes": "When a voucher task specifies a budget but no discount amount, the old code used the raw budget as the price ceiling â€” rejecting valid products that cost just above budget but become affordable afte", "timestamp": "2026-04-23 11:42:07"}
{"iteration": 35, "score": 0.2333, "best": 0.5714, "eval_type": "FULL", "status": "REVERTED", "categories": {"product": 0.5, "shop": 0.2, "voucher": 0.0}, "changes": "Increased `MAX_SHOPS_WIDE_QUERY` from 6â†’8 and `MAX_SHOPS_FOR_TWO_OR_FEWER_SPECS` from 8â†’12, giving the same-shop search more candidate shops to evaluate before falling back â€” targeting the shop ", "timestamp": "2026-04-23 12:02:55"}
{"iteration": 36, "score": 0.2857, "best": 0.5714, "eval_type": "SAMPLE", "status": "REVERTED", "categories": {"product": 0.6667, "shop": 0.0, "voucher": 0.0}, "changes": "Added page 2 fetching to `_collect_broad_shop_results` so the same-shop discovery phase considers up to 20 products per spec instead of 10, giving the shop-matching algorithm a wider pool of candidate", "timestamp": "2026-04-23 12:10:47"}
{"iteration": 37, "score": 0.2857, "best": 0.5714, "eval_type": "SAMPLE", "status": "REVERTED", "categories": {"product": 0.6667, "shop": 0.0, "voucher": 0.0}, "changes": "Updated the `price_range` instruction in `_EXTRACTION_PROMPT` to prevent the LLM from incorrectly mapping the total voucher budget to `price_range` â€” when that happens, `_enrich_voucher_product_para", "timestamp": "2026-04-23 12:18:24"}
{"iteration": 38, "score": 0.2857, "best": 0.5714, "eval_type": "SAMPLE", "status": "REVERTED", "categories": {"product": 0.6667, "shop": 0.0, "voucher": 0.0}, "changes": "Changed `_enrich_voucher_product_params` to override the LLM-set `price_range` when it's tighter than the gross-budget ceiling â€” this fixes the systematic voucher=0.0 failure caused by the LLM incor", "timestamp": "2026-04-23 12:25:41"}
{"iteration": 39, "score": 0.2857, "best": 0.5714, "eval_type": "SAMPLE", "status": "REVERTED", "categories": {"product": 0.6667, "shop": 0.0, "voucher": 0.0}, "changes": "When `find_products_in_same_shop` fails and the specs include price filters, retry with price-stripped queries â€” price constraints in broad discovery limit which shops are discovered as candidates, ", "timestamp": "2026-04-23 12:34:41"}
{"iteration": 40, "score": 0.2333, "best": 0.5714, "eval_type": "FULL", "status": "REVERTED", "categories": {"product": 0.5, "shop": 0.2, "voucher": 0.0}, "changes": "Removed price filter from the broad shop discovery phase so more candidate shops surface (shops carrying the right products at any price are now discovered), while price constraints are still enforced", "timestamp": "2026-04-23 12:49:58"}
{"iteration": 41, "score": 0.1429, "best": 0.5714, "eval_type": "SAMPLE", "status": "REVERTED", "categories": {"product": 0.3333, "shop": 0.0, "voucher": 0.0}, "changes": "Added page 2 fetching to `_handle_single_product` so product tasks consider up to 20 candidates instead of 10, giving the relevance scorer a wider pool to find better attribute matches.", "timestamp": "2026-04-23 12:56:11"}
{"iteration": 42, "score": 0.1429, "best": 0.5714, "eval_type": "SAMPLE", "status": "REVERTED", "categories": {"product": 0.3333, "shop": 0.0, "voucher": 0.0}, "changes": "Increased `MAX_SHOPS_WIDE_QUERY` from 6 to 10 and `MAX_SHOPS_FOR_TWO_OR_FEWER_SPECS` from 8 to 14 so the shop search explores more candidate shops before giving up, since the target shop is likely bei", "timestamp": "2026-04-23 13:04:33"}
{"iteration": 43, "score": 0.5714, "best": 0.5714, "eval_type": "SAMPLE", "status": "REVERTED", "categories": {"product": 0.6667, "shop": 0.5, "voucher": 0.5}, "changes": "Added page 2 fetching to `_collect_broad_shop_results` so broad shop discovery considers up to 20 products per spec instead of 10, doubling the candidate shop pool and increasing the chance of discove", "timestamp": "2026-04-23 13:08:59"}
{"iteration": 44, "score": 0.4286, "best": 0.5714, "eval_type": "SAMPLE", "status": "REVERTED", "categories": {"product": 0.6667, "shop": 0.0, "voucher": 0.5}, "changes": "Added page 2 fetching to `_collect_broad_shop_results` so broad shop discovery considers up to 20 products per spec instead of 10, doubling the candidate shop pool and increasing the chance of finding", "timestamp": "2026-04-23 13:14:34"}
{"iteration": 45, "score": 0.2667, "best": 0.5714, "eval_type": "FULL", "status": "REVERTED", "categories": {"product": 0.6, "shop": 0.1, "voucher": 0.1}, "changes": "Added page 2 fetching (without price filter) to `_collect_broad_shop_results` to double the shop candidate pool during broad discovery, replicating the iteration 43 approach that achieved the best sco", "timestamp": "2026-04-23 13:29:43"}
{"iteration": 46, "score": 0.4286, "best": 0.5714, "eval_type": "SAMPLE", "status": "REVERTED", "categories": {"product": 0.3333, "shop": 0.5, "voucher": 0.5}, "changes": "Removed price filter from broad shop discovery in `_collect_broad_shop_results` so that shops whose products happen to fall outside the spec's price range are still discovered during the initial sweep", "timestamp": "2026-04-23 13:35:58"}
{"iteration": 47, "score": 0.2857, "best": 0.5714, "eval_type": "SAMPLE", "status": "REVERTED", "categories": {"product": 0.3333, "shop": 0.0, "voucher": 0.5}, "changes": "Added page 2 fetching to `_handle_single_product` so the single-product task considers up to 20 candidates instead of 10 before picking the best match, matching the same strategy already used by the v", "timestamp": "2026-04-23 13:39:36"}
{"iteration": 48, "score": 0.2857, "best": 0.5714, "eval_type": "SAMPLE", "status": "REVERTED", "categories": {"product": 0.3333, "shop": 0.0, "voucher": 0.5}, "changes": "Changed `_score_shop_coverage` to use per-spec keywords for relevance scoring instead of the full original query, so each spec's candidate products are ranked against their own focused search terms ra", "timestamp": "2026-04-23 13:48:10"}
{"iteration": 49, "score": 0.2857, "best": 0.5714, "eval_type": "SAMPLE", "status": "REVERTED", "categories": {"product": 0.3333, "shop": 0.5, "voucher": 0.0}, "changes": "Increased `MAX_SHOPS_WIDE_QUERY` from 6â†’10 and `MAX_SHOPS_FOR_TWO_OR_FEWER_SPECS` from 8â†’12 so the same-shop search tries more candidate shops before giving up, improving coverage for shop tasks w", "timestamp": "2026-04-23 13:56:11"}
{"iteration": 50, "score": 0.3333, "best": 0.5714, "eval_type": "FULL", "status": "REVERTED", "categories": {"product": 0.6, "shop": 0.2, "voucher": 0.2}, "changes": "Added a price-free supplementary search in `_collect_broad_shop_results` so that when a spec has a price filter, results from both the filtered and unfiltered searches are combined â€” this widens the", "timestamp": "2026-04-23 14:14:35"}
{"iteration": 51, "score": 0.2857, "best": 0.5714, "eval_type": "SAMPLE", "status": "REVERTED", "categories": {"product": 0.6667, "shop": 0.0, "voucher": 0.0}, "changes": "Added page 2 fetching to `_collect_broad_shop_results` so the same-shop candidate pool doubles (up to ~20 products per spec instead of ~10), giving the shop discovery phase a better chance of finding ", "timestamp": "2026-04-23 14:20:15"}
{"iteration": 52, "score": 0.1429, "best": 0.5714, "eval_type": "SAMPLE", "status": "REVERTED", "categories": {"product": 0.3333, "shop": 0.0, "voucher": 0.0}, "changes": "Added a retry in `_handle_same_shop_search` with shortened (first 3 words) keywords when the full-keyword same-shop search fails, so shops carrying all required items but not surfacing with long speci", "timestamp": "2026-04-23 14:26:24"}
{"iteration": 53, "score": 0.2857, "best": 0.5714, "eval_type": "SAMPLE", "status": "REVERTED", "categories": {"product": 0.6667, "shop": 0.0, "voucher": 0.0}, "changes": "For multi-product voucher tasks, removed the per-product `budget/n_products` price ceiling (which incorrectly filtered out valid products whose individual price exceeded that fraction of the budget) â", "timestamp": "2026-04-23 14:30:51"}
