{"iteration": 0, "score": 0.2857, "best": 0.2857, "eval_type": "BASELINE", "status": "BASELINE", "timestamp": "2026-04-24 07:04:01"}
{"iteration": 1, "score": 0.4286, "best": 0.4286, "eval_type": "SAMPLE", "status": "KEPT", "categories": {"product": 0.3333, "shop": 0.5, "voucher": 0.5}, "changes": "Added a page 2 search for single-product tasks to double the candidate pool from 10 to up to 20 results, giving the relevance scoring more high-quality options to select the best product match from.", "timestamp": "2026-04-24 07:09:15"}
{"iteration": 2, "score": 0.4286, "best": 0.4286, "eval_type": "SAMPLE", "status": "REVERTED", "categories": {"product": 0.3333, "shop": 0.5, "voucher": 0.5}, "changes": "Added a third search using the first 3 keywords of the extracted query (retaining price/service filters) to diversify the product candidate pool — shorter Lucene queries surface different products t", "timestamp": "2026-04-24 07:14:12"}
{"iteration": 3, "score": 0.4286, "best": 0.4286, "eval_type": "SAMPLE", "status": "REVERTED", "categories": {"product": 0.3333, "shop": 0.5, "voucher": 0.5}, "changes": "Used LLM-extracted keywords instead of the full noisy query for product relevance scoring in `_handle_single_product`, so the title-overlap scoring focuses on actual product terms rather than filler p", "timestamp": "2026-04-24 07:18:33"}
{"iteration": 4, "score": 0.4286, "best": 0.4286, "eval_type": "SAMPLE", "status": "REVERTED", "categories": {"product": 0.3333, "shop": 0.5, "voucher": 0.5}, "changes": "Added LLM-extracted keyword scoring as a 0.5-weight bonus on top of full-query scoring in `_select_best_product`, so single-product candidates matching both the full query AND the focused LLM keywords", "timestamp": "2026-04-24 07:24:27"}
{"iteration": 5, "score": 0.3333, "best": 0.4286, "eval_type": "FULL", "status": "REVERTED", "categories": {"product": 0.5, "shop": 0.3, "voucher": 0.2}, "changes": "Added a supplementary search without the service API filter (when a service requirement exists) that post-filters results by the required service tags — this diversifies the candidate pool by surfac", "timestamp": "2026-04-24 07:42:49"}
{"iteration": 6, "score": 0.5714, "best": 0.5714, "eval_type": "SAMPLE", "status": "KEPT", "categories": {"product": 0.6667, "shop": 0.5, "voucher": 0.5}, "changes": "Increased `TOP_RELEVANCE_CANDIDATES` and `MAX_DETAIL_LOOKUP_PRODUCTS` from 10 to 20 so that all candidates gathered from pages 1+2 (up to 20 products) receive full attribute-based rescoring, not just ", "timestamp": "2026-04-24 07:51:14"}
{"iteration": 7, "score": 0.5714, "best": 0.5714, "eval_type": "SAMPLE", "status": "REVERTED", "categories": {"product": 0.6667, "shop": 0.5, "voucher": 0.5}, "changes": "Added page 2 to the broad shop search phase so each spec now surfaces up to 20 products instead of 10, doubling the number of candidate shops discovered and increasing the chance of finding one that s", "timestamp": "2026-04-24 07:55:25"}
{"iteration": 8, "score": 0.4286, "best": 0.5714, "eval_type": "SAMPLE", "status": "REVERTED", "categories": {"product": 0.3333, "shop": 0.5, "voucher": 0.5}, "changes": "Added LLM-based reranking of top-3 keyword-scored candidates in `_handle_single_product`, so the final product selection uses semantic understanding (rather than pure keyword overlap) to pick the best", "timestamp": "2026-04-24 08:03:09"}
{"iteration": 9, "score": 0.5714, "best": 0.5714, "eval_type": "SAMPLE", "status": "REVERTED", "categories": {"product": 0.6667, "shop": 0.5, "voucher": 0.5}, "changes": "Changed `_handle_single_product` to score candidates against the LLM-extracted `keywords` (e.g. \"blue iPhone 15 Pro Max case\") instead of the full raw query (which contains noise like \"I'm looking for", "timestamp": "2026-04-24 08:06:52"}
{"iteration": 10, "score": 0.3667, "best": 0.5714, "eval_type": "FULL", "status": "REVERTED", "categories": {"product": 0.6, "shop": 0.3, "voucher": 0.2}, "changes": "Removed price filter from the broad shop-discovery phase so more candidate shops are surfaced during the initial sweep, while price constraints are still enforced in the per-shop product-selection ste", "timestamp": "2026-04-24 08:25:55"}
{"iteration": 11, "score": 0.5714, "best": 0.5714, "eval_type": "SAMPLE", "status": "REVERTED", "categories": {"product": 0.6667, "shop": 0.5, "voucher": 0.5}, "changes": "Increased `MAX_SHOPS_WIDE_QUERY` from 6→10 and `MAX_SHOPS_FOR_TWO_OR_FEWER_SPECS` from 8→12 so the same-shop search tries more candidate shops before giving up, covering cases where the correct sh", "timestamp": "2026-04-24 08:35:29"}
{"iteration": 12, "score": 0.5714, "best": 0.5714, "eval_type": "SAMPLE", "status": "REVERTED", "categories": {"product": 0.6667, "shop": 0.5, "voucher": 0.5}, "changes": "Added voucher discount cap extraction to `_derive_voucher_price_ceiling`: when the query specifies a maximum/capped discount (e.g. \"max discount PHP 100\"), `gross_budget` is now bounded by `budget + c", "timestamp": "2026-04-24 08:42:30"}
{"iteration": 13, "score": 0.5714, "best": 0.5714, "eval_type": "SAMPLE", "status": "REVERTED", "categories": {"product": 0.6667, "shop": 0.5, "voucher": 0.5}, "changes": "In `_score_shop_coverage`, swapped `original_query or spec[\"q\"]` to `spec[\"q\"] or original_query` so each product slot is scored against its own LLM-extracted keywords rather than the full multi-produ", "timestamp": "2026-04-24 08:48:38"}
{"iteration": 14, "score": 0.4286, "best": 0.5714, "eval_type": "SAMPLE", "status": "REVERTED", "categories": {"product": 0.6667, "shop": 0.5, "voucher": 0.0}, "changes": "Added page 2 to the broad shop discovery phase so each spec's candidate pool doubles (up to 20 products per spec instead of 10), increasing the chance that the correct same-shop vendor appears in the ", "timestamp": "2026-04-24 08:56:04"}
{"iteration": 15, "score": 0.3333, "best": 0.5714, "eval_type": "FULL", "status": "REVERTED", "categories": {"product": 0.6, "shop": 0.3, "voucher": 0.1}, "changes": "Changed `_collect_broad_shop_results` to fetch both page 1 and page 2 for each spec, doubling the candidate shop pool during broad discovery so the correct same-shop vendor is more likely to appear be", "timestamp": "2026-04-24 09:20:15"}
{"iteration": 16, "score": 0.5714, "best": 0.5714, "eval_type": "SAMPLE", "status": "REVERTED", "categories": {"product": 0.6667, "shop": 0.5, "voucher": 0.5}, "changes": "Added per-product price-filter fallback in `_search_products_individually`: when a price-filtered search returns zero results for a specific product (e.g. because the derived voucher ceiling is too ti", "timestamp": "2026-04-24 09:26:16"}
{"iteration": 17, "score": 0.5714, "best": 0.5714, "eval_type": "SAMPLE", "status": "REVERTED", "categories": {"product": 0.6667, "shop": 0.5, "voucher": 0.5}, "changes": "Expanded `_derive_voucher_price_ceiling` with 5 additional budget extraction patterns (\"up to PHP X\", \"maximum PHP X\", \"total of PHP X\", \"spend PHP X\", \"X pesos budget\") and added \"percent off\" and \"p", "timestamp": "2026-04-24 09:36:25"}
{"iteration": 18, "score": 0.5714, "best": 0.5714, "eval_type": "SAMPLE", "status": "REVERTED", "categories": {"product": 0.6667, "shop": 0.5, "voucher": 0.5}, "changes": "Used spec-level `keywords` (the field name the LLM actually sets) as the primary scoring query in `_score_shop_coverage` and `_pick_products_for_shop`, falling back to `original_query` only when empty", "timestamp": "2026-04-24 09:41:05"}
{"iteration": 19, "score": 0.5714, "best": 0.5714, "eval_type": "SAMPLE", "status": "REVERTED", "categories": {"product": 0.6667, "shop": 0.5, "voucher": 0.5}, "changes": "In `_handle_single_product`, when the fallback search (no price/service filters) runs, we now prefer service-compliant products from the fallback results before selecting the best match — preventing", "timestamp": "2026-04-24 09:49:00"}
{"iteration": 20, "score": 0.3, "best": 0.5714, "eval_type": "FULL", "status": "REVERTED", "categories": {"product": 0.5, "shop": 0.3, "voucher": 0.1}, "changes": "Changed `_handle_single_product` to score candidates using LLM-extracted `keywords` instead of the full `query`, making it consistent with voucher/shop paths — this removes scoring noise from price ", "timestamp": "2026-04-24 10:07:09"}
{"iteration": 21, "score": 0.5714, "best": 0.5714, "eval_type": "SAMPLE", "status": "REVERTED", "categories": {"product": 0.6667, "shop": 0.5, "voucher": 0.5}, "changes": "Expanded `_collect_broad_shop_results` to fetch page 2 alongside page 1 for each spec, doubling the candidate shop pool (20 products per spec instead of 10) without consuming dialogue steps — this s", "timestamp": "2026-04-24 10:13:51"}
{"iteration": 22, "score": 0.5714, "best": 0.5714, "eval_type": "SAMPLE", "status": "REVERTED", "categories": {"product": 0.6667, "shop": 0.5, "voucher": 0.5}, "changes": "Changed `_derive_voucher_price_ceiling` to use `gross_budget * 0.9` as the per-product price ceiling instead of `gross_budget / n_products` — this prevents valid products from being filtered out whe", "timestamp": "2026-04-24 10:19:37"}
{"iteration": 23, "score": 0.4286, "best": 0.5714, "eval_type": "SAMPLE", "status": "REVERTED", "categories": {"product": 0.6667, "shop": 0.0, "voucher": 0.5}, "changes": "Added a retry in `_handle_same_shop_search` that, when the first `find_products_in_same_shop` call fails, tries again with only the first 2 words of each spec's keywords (e.g., \"bicycle helmet\" instea", "timestamp": "2026-04-24 10:29:32"}
{"iteration": 24, "score": 0.5714, "best": 0.5714, "eval_type": "SAMPLE", "status": "REVERTED", "categories": {"product": 0.6667, "shop": 0.5, "voucher": 0.5}, "changes": "Added an intermediate fallback in `_handle_single_product` that retries with the service filter intact but no price filter, so queries where the LLM misextracts the price range can still find service-", "timestamp": "2026-04-24 10:39:53"}
{"iteration": 25, "score": 0.3667, "best": 0.5714, "eval_type": "FULL", "status": "REVERTED", "categories": {"product": 0.6, "shop": 0.3, "voucher": 0.2}, "changes": "Increased `MAX_SHOPS_WIDE_QUERY` from 6→10 and `MAX_SHOPS_FOR_TWO_OR_FEWER_SPECS` from 8→12 so `find_products_in_same_shop` tries more candidate shops before giving up, catching valid same-shop so", "timestamp": "2026-04-24 10:58:22"}
{"iteration": 26, "score": 0.4286, "best": 0.5714, "eval_type": "SAMPLE", "status": "REVERTED", "categories": {"product": 0.3333, "shop": 0.5, "voucher": 0.5}, "changes": "Used extracted LLM keywords instead of the full raw query for relevance scoring in `_handle_single_product`, removing price/service text noise that can mislead title-overlap scoring (consistent with h", "timestamp": "2026-04-24 11:03:03"}
{"iteration": 27, "score": 0.5714, "best": 0.5714, "eval_type": "SAMPLE", "status": "REVERTED", "categories": {"product": 0.6667, "shop": 0.5, "voucher": 0.5}, "changes": "Changed the voucher retry condition from `if not product_ids` (only retries when ALL product searches return empty) to `if len(product_ids) < n_needed` (retries whenever any product is missing), so pa", "timestamp": "2026-04-24 11:09:46"}
{"iteration": 28, "score": 0.4286, "best": 0.5714, "eval_type": "SAMPLE", "status": "REVERTED", "categories": {"product": 0.6667, "shop": 0.5, "voucher": 0.0}, "changes": "Removed price filters from the broad shop-discovery phase in `_collect_broad_shop_results` — price constraints now only apply when selecting the actual recommended product in `_pick_products_for_sho", "timestamp": "2026-04-24 11:15:42"}
{"iteration": 29, "score": 0.5714, "best": 0.5714, "eval_type": "SAMPLE", "status": "REVERTED", "categories": {"product": 0.6667, "shop": 0.5, "voucher": 0.5}, "changes": "Added page 2 fetching to the broad shop discovery phase so shops whose products only appear on page 2 of search results are now included as candidates, without increasing the number of shops actually ", "timestamp": "2026-04-24 11:20:58"}
{"iteration": 30, "score": 0.3667, "best": 0.5714, "eval_type": "FULL", "status": "REVERTED", "categories": {"product": 0.6, "shop": 0.3, "voucher": 0.2}, "changes": "In `_score_shop_coverage`, swapped scoring priority so each product is evaluated against its own spec's keywords (not the full multi-product query), reducing noise when ranking candidate shops for sam", "timestamp": "2026-04-24 11:37:50"}
{"iteration": 31, "score": 0.5714, "best": 0.5714, "eval_type": "SAMPLE", "status": "REVERTED", "categories": {"product": 0.6667, "shop": 0.5, "voucher": 0.5}, "changes": "Changed the voucher retry condition from `if not product_ids` to `if len(product_ids) < n_needed` so partial search failures (e.g., finding 1 of 2 required products) trigger a no-price-constraint retr", "timestamp": "2026-04-24 11:42:02"}
{"iteration": 32, "score": 0.5714, "best": 0.5714, "eval_type": "SAMPLE", "status": "REVERTED", "categories": {"product": 0.6667, "shop": 0.5, "voucher": 0.5}, "changes": "For multi-product voucher tasks, always apply the derived per-product price ceiling instead of trusting the LLM's price_range (which often mirrors the total budget for each product, causing total cost", "timestamp": "2026-04-24 11:54:07"}
{"iteration": 33, "score": 0.5714, "best": 0.5714, "eval_type": "SAMPLE", "status": "REVERTED", "categories": {"product": 0.6667, "shop": 0.5, "voucher": 0.5}, "changes": "Applied service-constraint re-filtering after the no-price/no-service fallback in `_handle_single_product`: when the broad fallback search returns results, the agent now prefers products that satisfy ", "timestamp": "2026-04-24 12:01:02"}
{"iteration": 34, "score": 0.5714, "best": 0.5714, "eval_type": "SAMPLE", "status": "REVERTED", "categories": {"product": 0.6667, "shop": 0.5, "voucher": 0.5}, "changes": "Removed price filtering from the broad shop discovery phase so more candidate shops are surfaced — price constraints are still enforced when selecting specific products from each candidate shop via ", "timestamp": "2026-04-24 12:08:18"}
{"iteration": 35, "score": 0.4667, "best": 0.5714, "eval_type": "FULL", "status": "REVERTED", "categories": {"product": 0.6, "shop": 0.6, "voucher": 0.2}, "changes": "Fetched page 2 in the broad shop discovery phase so candidate shops whose products appear on page 2 (beyond the first 10 results) are now included when ranking potential same-shop matches.", "timestamp": "2026-04-24 12:25:19"}
{"iteration": 36, "score": 0.4286, "best": 0.5714, "eval_type": "SAMPLE", "status": "REVERTED", "categories": {"product": 0.3333, "shop": 0.5, "voucher": 0.5}, "changes": "Added bigram phrase matching to `_score_product_relevance`: when two consecutive non-stopword query words appear as an exact adjacent phrase in the product title, the product gets a +3 bonus, rewardin", "timestamp": "2026-04-24 12:35:36"}
{"iteration": 37, "score": 0.5714, "best": 0.5714, "eval_type": "SAMPLE", "status": "REVERTED", "categories": {"product": 0.6667, "shop": 0.5, "voucher": 0.5}, "changes": "Changed `_enrich_voucher_product_params` to also override the LLM's `price_range` when its max value exceeds the derived per-product budget ceiling — fixing the common failure where the LLM mirrors ", "timestamp": "2026-04-24 12:43:43"}
{"iteration": 38, "score": 0.4286, "best": 0.5714, "eval_type": "SAMPLE", "status": "REVERTED", "categories": {"product": 0.3333, "shop": 0.5, "voucher": 0.5}, "changes": "Used LLM-extracted keywords (instead of the raw natural-language query) for relevance scoring in `_handle_single_product`, since raw queries contain price numbers and service terms that create false-p", "timestamp": "2026-04-24 12:54:43"}
{"iteration": 39, "score": 0.5714, "best": 0.5714, "eval_type": "SAMPLE", "status": "REVERTED", "categories": {"product": 0.6667, "shop": 0.5, "voucher": 0.5}, "changes": "When the initial same-shop search fails (keywords too specific to surface the right shop), retry with simplified 3-word queries and no price/service constraints to broaden shop discovery — this give", "timestamp": "2026-04-24 13:03:00"}
{"iteration": 40, "score": 0.3667, "best": 0.5714, "eval_type": "FULL", "status": "REVERTED", "categories": {"product": 0.6, "shop": 0.3, "voucher": 0.2}, "changes": "Added a keyword-only retry for `find_products_in_same_shop` when the first attempt fails: since the existing per-product fallback never satisfies the same-shop constraint (products come from different", "timestamp": "2026-04-24 13:28:15"}
{"iteration": 41, "score": 0.5714, "best": 0.5714, "eval_type": "SAMPLE", "status": "REVERTED", "categories": {"product": 0.6667, "shop": 0.5, "voucher": 0.5}, "changes": "Changed `_collect_broad_shop_results` to fetch both page 1 and page 2 for each spec during same-shop discovery, doubling the candidate shop pool so shops that appear deeper in search results can be fo", "timestamp": "2026-04-24 13:33:53"}
{"iteration": 42, "score": 0.5714, "best": 0.5714, "eval_type": "SAMPLE", "status": "REVERTED", "categories": {"product": 0.6667, "shop": 0.5, "voucher": 0.5}, "changes": "Changed `_handle_voucher_search` to use full raw query for relevance scoring (`use_keyword_query_for_multi=False`) instead of LLM keywords, mirroring the approach in `_handle_single_product` — the s", "timestamp": "2026-04-24 13:41:45"}
{"iteration": 43, "score": 0.5714, "best": 0.5714, "eval_type": "SAMPLE", "status": "REVERTED", "categories": {"product": 0.6667, "shop": 0.5, "voucher": 0.5}, "changes": "Fixed a bug in `_enrich_voucher_product_params` where an early return when the LLM had already set product price ranges caused the budget ceiling to be skipped entirely — now the function always tig", "timestamp": "2026-04-24 13:51:23"}
{"iteration": 44, "score": 0.4286, "best": 0.5714, "eval_type": "SAMPLE", "status": "REVERTED", "categories": {"product": 0.6667, "shop": 0.5, "voucher": 0.0}, "changes": "Increased MAX_SHOPS_WIDE_QUERY from 6→10 and MAX_SHOPS_FOR_TWO_OR_FEWER_SPECS from 8→14 so that correct shops ranked 7-10 (due to partial broad-search coverage) are now tried via targeted shop-sco", "timestamp": "2026-04-24 14:00:08"}
{"iteration": 45, "score": 0.3333, "best": 0.5714, "eval_type": "FULL", "status": "REVERTED", "categories": {"product": 0.5, "shop": 0.4, "voucher": 0.1}, "changes": "Added `_filter_products_by_price_range` and applied it in the fallback path of `_handle_single_product` so that when the strict price+service API search returns nothing and we retry without filters, t", "timestamp": "2026-04-24 14:16:26"}
{"iteration": 46, "score": 0.5714, "best": 0.5714, "eval_type": "SAMPLE", "status": "REVERTED", "categories": {"product": 0.6667, "shop": 0.5, "voucher": 0.5}, "changes": "When `find_products_in_same_shop` fails for non-voucher shop tasks and price constraints were used, retry with price-free queries to widen shop discovery — this addresses cases where LLM-extracted p", "timestamp": "2026-04-24 14:24:41"}
{"iteration": 47, "score": 0.4286, "best": 0.5714, "eval_type": "SAMPLE", "status": "REVERTED", "categories": {"product": 0.6667, "shop": 0.5, "voucher": 0.0}, "changes": "Added page 2 fetching to `_collect_broad_shop_results` so each spec sees up to 20 candidate products (instead of 10) during shop discovery, increasing the chance of finding a shop that carries all req", "timestamp": "2026-04-24 14:31:27"}
{"iteration": 48, "score": 0.2857, "best": 0.5714, "eval_type": "SAMPLE", "status": "REVERTED", "categories": {"product": 0.3333, "shop": 0.5, "voucher": 0.0}, "changes": "Added page 3 fetching to `_handle_single_product` so product tasks now evaluate up to 30 filtered candidates instead of 20, increasing the chance of finding the correct product when it ranks 21-30 in ", "timestamp": "2026-04-24 14:41:16"}
{"iteration": 49, "score": 0.5714, "best": 0.5714, "eval_type": "SAMPLE", "status": "REVERTED", "categories": {"product": 0.6667, "shop": 0.5, "voucher": 0.5}, "changes": "Changed the voucher fallback condition from `if not product_ids:` to `if len(product_ids) < len(products):` so that partial results (e.g., 1 of 2 required products found within price ceiling) also tri", "timestamp": "2026-04-24 14:46:53"}
{"iteration": 50, "score": 0.3667, "best": 0.5714, "eval_type": "FULL", "status": "REVERTED", "categories": {"product": 0.6, "shop": 0.3, "voucher": 0.2}, "changes": "Added per-product inline price-filter retry in `_search_products_individually`: when a price-ceiling search returns nothing for a specific product, immediately retry without the price constraint befor", "timestamp": "2026-04-24 15:07:11"}
